	id	aspect	direct	factual	opinion	comp	question	dataset
1926	22368	0	0	8	8	1	What are the best TV series you ever watched and why?	q
1927	22369	0	0	0	1	1	What are the best viral videos?	q
1928	22370	0	0	0	0	1	What are the best was to lose weight?	q
1929	22371	0	0	8	8	1	What are the best way to increase website traffic organically?	q
1930	22372	0	0	0	0	1	What are the best way to lead a life?	q
1931	22373	0	0	8	8	1	What are the best ways of learning German quickly?	q
1932	22374	0	0	8	8	1	What are the best ways to ask a question on Quora?	q
1933	22375	0	0	0	0	1	What are the best ways to attract investors to your business or idea?	q
1934	22376	0	0	0	0	1	What are the best ways to cope up with a rude room-mate, avoiding any serious clashes?	q
1935	22377	0	0	8	8	1	What are the best ways to get more views & subscribers on YouTube?	q
1936	22378	0	0	0	0	1	What are the best ways to get rid of acne?	q
1937	22379	0	0	0	0	1	What are the best ways to improve my English because I'm not good in English?	q
1938	22380	0	0	8	8	1	What are the best ways to improve my memory?	q
1939	22381	0	0	8	8	1	What are the best ways to learn cmd?	q
1940	22382	0	0	8	8	1	What are the best ways to lose a lot of weight as quickly as possible?	q
1941	22383	0	0	0	0	1	What are the best ways to lose weight without exercise?	q
1942	22384	0	0	8	8	1	What are the best ways to lose weight?	q
1943	22385	0	0	0	0	1	What are the best ways to lose weight? What is the best diet plan?	q
1944	22386	0	0	0	0	1	What are the best ways to make money online?	q
1945	22387	0	0	8	8	1	What are the best ways to overcome my social anxiety?	q
1946	22388	0	0	0	0	1	What are the best ways to overcome stage fright?	q
1947	22389	0	0	0	0	1	What are the best ways to propose to your crush?	q
1948	22390	0	0	0	0	1	What are the best ways to reduce and eliminate belly, abdominal, and thigh fat?	q
1949	22391	0	0	8	8	1	What are the best ways to reduce belly fat without going to gym?	q
1950	22392	0	0	8	8	1	What are the best ways to skin a rabbit?	q
1951	22393	0	0	8	8	1	What are the best ways to speak English fluently?	q
1952	22394	0	0	0	1	1	What are the best ways to think of ideas for a startup?	q
1953	22395	0	0	8	8	1	What are the best ways to use windows?	q
1954	22396	0	0	8	8	1	What are the best weapons to use against zombies?	q
1955	22397	0	0	8	8	1	What are the best website builders for 2013?	q
1956	22398	0	0	0	1	1	What are the best websites for architecture students?	q
1957	22399	0	0	0	1	1	What are the best websites for bank exams preparation?	q
1958	22400	1	0	8	8	1	What are the best websites for learning programming languages?	q
1959	22401	0	0	8	8	1	What are the best websites in online jobs?	q
1960	22402	0	0	0	1	1	What are the best WhatsApp statuses in Kannada?	q
1961	22403	0	0	8	8	1	What are the best Woody Allen films?	q
1962	22404	0	0	0	1	1	What are the best YA fairy tale retellings?	q
1963	22405	1	0	8	8	1	What are the best yoga pants for showing off camel toe?	q
1964	22406	1	0	0	1	1	What are the best you tube channel for undergraduate of Mathematics?	q
1965	22407	1	0	0	1	1	What are the best YouTube channels for news?	q
1966	22408	1	0	0	1	1	What are the novels with the best twists?	q
1967	22409	1	0	8	8	1	What country has the best healthcare system in the world?	q
1968	22410	0	0	8	8	1	What day in your life did you consider to be the best day ever?	q
1969	22411	0	0	0	1	1	What do you think is the best solution for the Kashmir issue?	q
1970	22412	0	0	0	1	1	What has been the best movie of 2016?	q
1971	22413	1	0	0	1	1	What is best playstations for gaming?	q
1972	22414	0	1	0	1	1	What is the best -- Core i5 4440 or Core i5 3470?	q
1973	22415	0	0	0	1	1	What is the best Agatha Christie book in your opinion?	q
1974	22416	0	0	8	8	1	What is the best age to teach a child how to swim?	q
1975	22417	1	0	8	8	1	What is the best airline to fly from India to USA?	q
1976	22418	0	0	0	1	1	What is the best alternative (free or not) to Dropbox?	q
1977	22419	0	0	0	1	1	What is the best Android tablet in 2015?	q
1978	22420	0	0	0	1	1	What is the best animation software?	q
1979	22421	1	0	0	1	1	"What is the best answer according to you when a recruiter asks ""why are you leaving your current company""?"	q
1980	22422	1	0	8	8	1	What is the best answer for tell me about yourself in an interview?	q
1981	22423	1	0	0	1	1	What is the best answer when we are asked by interviewers why should we hire you?	q
1982	22424	1	0	0	1	1	What is the best answer you have ever given to any question?	q
1983	22425	0	0	8	8	1	What is the best approach to responding to unsolicited job inquiries?	q
1984	22426	0	0	8	8	1	What is the best backup software for Windows 10?	q
1985	22427	0	0	8	8	1	What is the best bartending school in Toronto? What are the requirements to attend this school?	q
1986	22428	0	0	0	1	1	What is the best beach in Goa?	q
1987	22429	0	0	0	1	1	What is the best beading software out there?	q
1988	22430	0	0	8	8	1	What is the best beginner friendly book on python?	q
1989	22431	1	0	8	8	1	What is the best beginners online course for programming?	q
1990	22432	0	0	0	1	1	What is the best book by Sadhguru Jaggi Vasudev?	q
1991	22433	0	0	0	1	1	What is the best book C. S. Lewis ever wrote?	q
1992	22434	0	0	8	8	1	What is the best book or textbook on product management?	q
1993	22435	0	0	8	8	1	What is the best book to learn about human behaviour?	q
1994	22436	0	0	0	1	1	What is the best book to learn data structures using Java?	q
1995	22437	0	0	8	8	1	What is the best book to learn English?	q
1996	22438	0	0	0	1	1	What is the best book to refer for National Income Accounting for UPSC?	q
1997	22439	0	0	0	1	1	What is the best book to study for the GRE?	q
1998	22440	1	0	8	8	1	What is the best brand and popular  tempered glass company for a smartphone in INDIA?	q
1999	22441	0	0	8	8	1	What is the best brand of soy sauce to go with fried rice?	q
2000	22442	0	0	0	1	1	What is the best business idea for a student?	q
2001	22443	0	0	8	8	1	What is the best certification course to learn digital marketing?	q
2002	22444	0	0	8	8	1	What is the best Chinese food dish?	q
2003	22445	1	0	0	1	1	What is the best city for holidays in India?	q
2004	22446	0	0	8	8	1	What is the best Cocteau Twins EP?	q
2005	22447	0	0	8	8	1	What is the best code troll you've ever seen?	q
2006	22448	0	0	8	8	1	What is the best comedy TV series?	q
2007	22449	0	0	0	1	1	What is the best comic book?	q
2008	22450	0	0	0	1	1	What is the best competitor for Quora?	q
2009	22451	0	0	0	1	1	What is the best completely free dating website?	q
2010	22452	0	0	0	1	1	What is the best compliment you've ever got?	q
2011	22453	0	0	0	1	1	What is the best conversation you had with a stranger?	q
2012	22454	0	0	0	1	1	What is the best definition of 'transdisciplinarity'?	q
2013	22455	0	0	8	8	1	What is the best degree to get for the future?	q
2014	22456	0	0	0	1	1	What is the best diet to gain weight?	q
2015	22457	1	0	0	1	1	What is the best early morning habit for success?	q
2016	22458	0	0	0	1	1	What is the best earphone under 1000 rs?	q
2017	22459	1	0	0	1	1	What is the best electrical engineering book for Gate exam?	q
2018	22460	0	0	0	1	1	What is the best English translation of the Bhagavad Gita?	q
2019	22461	0	0	8	8	1	"What is the best example of ""hard work pays off""?"	q
2020	22462	1	0	8	8	1	What is the best exercise for lowering cholesterol?	q
2021	22463	0	0	8	8	1	What is the best font type and size to use in a mobile app?	q
2022	22464	0	0	0	1	1	What is the best food delivery app in Sydney?	q
2023	22465	0	0	0	1	1	What is the best forum for communicating with retailers?	q
2024	22466	0	0	8	8	1	What is the best free porn website?	q
2025	22467	0	0	0	1	1	What is the best free site to learn to code from scratch?	q
2026	22468	0	0	0	1	1	What is the best fried chicken sandwich?	q
2027	22469	0	0	0	1	1	What is the best gluten free beer?	q
2028	22470	0	0	0	1	1	What is the best graphic design software?	q
2029	22471	0	0	0	1	1	What is the best helpdesk software?	q
2030	22472	0	0	8	8	1	What is the best instant ramen brand available in Spain?	q
2031	22473	1	0	0	1	1	What is the best institute for CAT preparation in Delhi?	q
2032	22474	0	0	0	1	1	What is the best IPA guide for American English?	q
2033	22475	0	0	0	1	1	What is the best iPad?	q
2034	22476	0	0	8	8	1	What is the best joke you have ever heard?	q
2035	22477	0	0	0	1	1	What is the best joke you've ever heard? Please keep it clean.	q
2036	22478	0	0	8	8	1	What is the best Korean dramas of all time?	q
2037	22479	1	0	0	1	1	What is the best language to learn programming?	q
2038	22480	1	0	8	8	1	What is the best laptop for a programmer?	q
2039	22481	0	0	0	1	1	What is the best laptop in 50000 in India?	q
2040	22482	0	0	8	8	1	What is the best League of Legends community?	q
2041	22483	0	0	8	8	1	What is the best lesson you have learned from your life?	q
2042	22484	0	0	0	1	1	What is the best LG G3 app?	q
2043	22485	0	0	8	8	1	What is the best martial art to practice?	q
2044	22486	0	0	8	8	1	What is the best medical university to study medicine in Ukraine?	q
2045	22487	0	0	0	1	1	What is the best method of losing weight?	q
2046	22488	0	0	0	1	1	What is the best method to develop photographic memory?	q
2047	22489	8	0	0	1	1	What is the best mindfuck novels?	q
2048	22490	0	0	0	1	1	What is the best mobile application technology?	q
2049	22491	1	0	8	8	1	What is the best motivational music one should listen to during a workout?	q
2050	22492	0	0	0	1	1	What is the best movie you have ever seen?	q
2051	22493	1	0	0	1	1	What is the best Nikon lens for macro photography?	q
2052	22494	1	0	0	1	1	What is the best online course for studying basic computer science?	q
2053	22495	1	0	0	1	1	What is the best online source for learning about options trading?	q
2054	22496	1	0	0	1	1	What is the best open source software to design a PID controller and HMI, with the end result file being an executable file?	q
2055	22497	0	0	8	8	1	What is the best option to respond to Pakistan after Uri attack?	q
2056	22498	1	0	8	8	1	What is the best order to read the Discworld novels by Terry Pratchett for maximum enjoyment?	q
2057	22499	1	0	0	1	1	What is the best oxide material to be used in memristor device so as to gain good on- off ratio and retention property?	q
2058	22500	0	0	0	1	1	What is the best passive investment strategy?	q
2059	22501	0	0	0	1	1	What is the best phone to buy below $100?	q
2060	22502	0	0	8	8	1	What is the best PHP framework to learn after learning Laravel?	q
2061	22503	1	0	0	1	1	What is the best pill for erectile dysfunction?	q
2062	22504	0	0	8	8	1	What is the best place for Ramen in Chicago?	q
2063	22505	1	0	0	1	1	What is the best place to get a hair transplant in Bangalore?	q
2064	22506	1	0	0	1	1	What is the best place to live in after retirement?	q
2065	22507	1	0	0	1	1	What is the best place to sell Supreme clothing?	q
2066	22508	1	0	0	0	1	What is the best place to sell your clash of clans account?	q
2067	22509	0	0	0	1	1	What is the best place to visit in summer?	q
2068	22510	0	0	0	1	1	What is the best place you want to visit in China?	q
2069	22511	0	0	8	8	1	What is the best position for sex?	q
2070	22512	0	0	8	8	1	What is the best possible solution of the kashmir issue?	q
2071	22513	0	0	8	8	1	What is the best prank that you have ever done?	q
2072	22514	0	0	0	1	1	What is the best program to learn another language and is possibly free?	q
2073	22515	0	0	8	8	1	What is the best program to make a logo?	q
2074	22516	0	0	0	1	1	What is the best programming language ever and why?	q
2075	22517	1	0	0	1	1	What is the best programming language for beginners to learn?	q
2076	22518	1	0	8	8	1	What is the best programming language for IoT?	q
2077	22519	1	0	0	1	1	What is the best programming language for job?	q
2078	22520	0	0	0	1	1	What is the best programming language in 2016?	q
2079	22521	0	0	8	8	1	What is the best programming language nowadays?	q
2080	22522	1	0	8	8	1	What is the best programming language one must learn to stay updated today?	q
2081	22523	0	0	8	8	1	What is the best project management tool with hierarchies?	q
2082	22524	0	0	0	1	1	What is the best protein powder?	q
2083	22525	0	0	8	8	1	What is the best quadcopter for under $200?	q
2084	22526	0	0	0	1	1	What is the best question asked in an interview?	q
2085	22527	0	0	8	8	1	What is the best question asked in your interview?	q
2086	22528	0	0	8	8	1	What is the best question you have asked on Quora?	q
2087	22529	0	0	0	1	1	What is the best real estate school in california?	q
2088	22530	0	0	0	1	1	What is the best retailer (online or brick and mortar) to buy a home computer from?	q
2089	22531	0	0	8	8	1	What is the best roller pen in India?	q
2090	22532	0	0	8	8	1	What is the best scripting language to learn today?	q
2091	22533	0	0	8	8	1	What is the best season of American Horror Story?	q
2092	22534	0	0	8	8	1	What is the best self defense trick you can learn within an hour?	q
2093	22535	0	0	8	8	1	What is the best sentimental movie of all time?	q
2094	22536	1	0	8	8	1	"What is the best short answer for ""why should I hire you""?"	q
2095	22537	0	0	8	8	1	What is the best simple lightweight image editor for Mac OS X?	q
2096	22538	0	0	0	1	1	What is the best site to hack Clash Royale?	q
2097	22539	0	0	0	1	1	What is the best site to sell my porn videos?	q
2098	22540	0	0	8	8	1	What is the best smartphone in the price range 7000-9000?	q
2099	22541	1	0	8	8	1	What is the best software for making furniture assembly videos?	q
2100	22542	1	0	0	1	1	What is the best software to implement machine learning/large scale data mining algorithms?	q
2101	22543	0	0	8	8	1	What is the best song to sing in a karaoke?	q
2102	22544	0	0	8	8	1	What is the best soothing song you've ever heard?	q
2103	22545	1	0	0	1	1	What is the best source for finding out how content creators build businesses using Youtube?	q
2104	22546	0	0	8	8	1	What is the best speaker phone?	q
2105	22547	0	0	0	1	1	What is the best stock market advice you have ever received?	q
2106	22548	1	0	8	8	1	What is the best strategy for the promotion of new websites?	q
2107	22549	1	0	0	1	1	What is the best strategy to advertise your affiliate business?	q
2108	22550	0	0	8	8	1	What is the best strip club in Vegas?	q
2109	22551	0	0	8	8	1	What is the best tank in World of Tanks?	q
2110	22552	0	0	0	1	1	What is the best the best to download anime?	q
2111	22553	0	0	8	8	1	What is the best thing to do after diploma?	q
2112	22554	0	0	8	8	1	What is the best thing to do to improve life?	q
2113	22555	0	0	0	1	1	What is the best thing your sibling has do ever done?	q
2114	22556	0	0	8	8	1	What is the best time of day to have sex?	q
2115	22557	0	0	0	1	1	What is the best time to visit meghalaya?	q
2116	22558	0	0	8	8	1	What is the best time to watch porn?	q
2117	22559	0	0	8	8	1	What is the best torrent site for movies?	q
2118	22560	0	0	8	8	1	What is the best torrent site for TV series and episodes?	q
2119	22561	0	0	8	8	1	What is the best tourist place in world?	q
2120	22562	1	0	8	8	1	What is the best university abroad for doing a MS in civil engineering?	q
2121	22563	0	0	8	8	1	What is the best university in Ukraine?	q
2122	22564	0	0	0	1	1	What is the best URL shortener?	q
2123	22565	0	0	8	8	1	What is the best use of a song during a movie or tv show scene?	q
2124	22566	0	0	8	8	1	What is the best vacation spot in Cuba?	q
2125	22567	1	0	8	8	1	What is the best video format to use for YouTube?	q
2126	22568	0	0	8	8	1	What is the best VR for Samsung Galaxy J7 Prime?	q
2127	22569	0	0	8	8	1	What is the best Washing machine brand, in India?	q
2128	22570	0	0	0	1	1	What is the best watching zone in an iMAX screen set in the theatre?	q
2129	22571	0	0	0	1	1	What is the best way (according to you) to have an estimate of one's intelligence?	q
2130	22572	0	0	8	8	1	What is the best way a University student can cope with stress regarding study ?	q
2131	22573	1	0	0	0	1	What is the best way and right age to introduce chess to a child?	q
2132	22574	1	0	0	1	1	What is the best way for a new CEO of a tech startup to approach & develop mentors in the funding & startup community?	q
2133	22575	1	0	0	0	1	What is the best way for an unexperienced person to start a business without any risk?	q
2134	22576	0	0	8	8	1	What is the best way for making money online?	q
2135	22577	0	0	8	8	1	What is the best way of getting pregnant during ovulation?	q
2136	22578	0	0	8	8	1	What is the best way of learning the American accent?	q
2137	22579	0	0	8	8	1	What is the best way the government of India should follow to get back black money?	q
2138	22580	0	0	0	1	1	What is the best way to add your websites backlinks in 2014?	q
2139	22581	0	0	8	8	1	What is the best way to anchor a steel bookcase to a wall?	q
2140	22582	0	0	8	8	1	What is the best way to ask out a coworker?	q
2141	22583	0	0	8	8	1	What is the best way to avoid questions needing improvement on Quora?	q
2142	22584	0	0	8	8	1	What is the best way to be in a calorie deficit and lose weight successfully?	q
2143	22585	0	0	8	8	1	What is the best way to beat frustration?	q
2144	22586	0	0	8	8	1	What is the best way to become more charismatic?	q
2145	22587	0	0	8	8	1	What is the best way to celebrate this Diwali?	q
2146	22588	0	0	8	8	1	What is the best way to charge an iPhone?	q
2147	22589	0	0	8	8	1	What is the best way to clean an engine?	q
2148	22590	0	0	8	8	1	What is the best way to connect map pins?	q
2149	22591	0	0	0	0	1	What is the best way to control our emotions?	q
2150	22592	0	0	8	8	1	What is the best way to cure a diarrhea case that was lasted over a week?	q
2151	22593	0	0	0	0	1	What is the best way to deal with a boss?	q
2152	22594	0	0	8	8	1	What is the best way to deal with smart-asses?	q
2153	22595	0	0	8	8	1	What is the best way to decide my career?	q
2154	22596	0	0	0	1	1	What is the best way to define happiness?	q
2155	22597	0	0	8	8	1	What is the best way to delete a virus?	q
2156	22598	0	0	8	8	1	What is the best way to earn money through online?	q
2157	22599	0	0	0	0	1	What is the best way to extract subtitles out of a YouTube video?	q
2158	22600	0	0	0	1	1	What is the best way to find a job in China as an expat?	q
2159	22601	0	0	8	8	1	What is the best way to get a job in customer service?	q
2160	22602	0	0	8	8	1	What is the best way to get a military star card?	q
2161	22603	8	0	8	8	1	What is the best way to get an orgasm?	q
2162	22604	0	0	0	0	1	What is the best way to get help?	q
2163	22605	0	0	0	0	1	What is the best way to get over depression without professional help?	q
2164	22606	0	0	8	8	1	What is the best way to get rid of face fat?	q
2165	22607	0	0	8	8	1	What is the best way to get started in learning electrical engineering?	q
2166	22608	0	0	8	8	1	What is the best way to give a PowerPoint presentation?	q
2167	22609	0	0	8	8	1	What is the best way to hack using cmd?	q
2168	22610	0	0	8	8	1	What is the best way to handle a heart break?	q
2169	22611	0	0	8	8	1	What is the best way to improve your web development skills?	q
2170	22612	0	0	8	8	1	What is the best way to increase endurance?	q
2171	22613	0	0	0	0	1	What is the best way to introduce 11 year-olds to programming?	q
2172	22614	0	0	8	8	1	What is the best way to learn Adobe Photoshop and Illustrator, and why?	q
2173	22615	0	0	8	8	1	What is the best way to learn calculus?	q
2174	22616	0	0	8	8	1	What is the best way to learn computer language?	q
2175	22617	0	0	8	8	1	What is the best way to learn English as a foreign?	q
2176	22618	0	0	8	8	1	What is the best way to learn how to hack (whitehat)?	q
2177	22619	0	0	8	8	1	What is the best way to learn JavaScript?	q
2178	22620	0	0	8	8	1	What is the best way to learn marketing online?	q
2179	22621	0	0	8	8	1	What is the best way to learn to do financial modelling?	q
2180	22622	0	0	8	8	1	What is the best way to lose belly fat? (workout, natural remedies and pills)	q
2181	22623	0	0	0	0	1	What is the best way to lose weight and not gain it back?	q
2182	22624	0	0	8	8	1	What is the best way to make an Android app for my website?	q
2183	22625	0	0	8	8	1	What is the best way to make extra money?	q
2184	22626	0	0	8	8	1	What is the best way to make man happy?	q
2185	22627	0	0	0	1	1	What is the best way to make money as a student in Canada?	q
2186	22628	0	0	8	8	1	What is the best way to make money fast?	q
2187	22629	0	0	8	8	1	What is the best way to make money through Android apps in India?	q
2188	22630	0	0	0	1	1	What is the best way to make money while studying in Europe?	q
2189	22631	0	0	8	8	1	What is the best way to market an online ecommerce website selling video games?	q
2190	22632	0	0	8	8	1	What is the best way to memorize or remember what you study/read?	q
2191	22633	0	0	8	8	1	What is the best way to minimize tension?	q
2192	22634	0	0	8	8	1	What is the best way to open a .doc file?	q
2193	22635	8	0	8	8	1	What is the best way to overcome an porn addiction?	q
2194	22636	0	0	8	8	1	What is the best way to pick lottery numbers?	q
2195	22637	0	0	8	8	1	What is the best way to prepare for CA final ISCA?	q
2196	22638	0	0	8	8	1	What is the best way to prepare for CA final law and audit?	q
2197	22639	0	0	8	8	1	What is the best way to prepare optics for CBSE class 12 boards?	q
2198	22640	0	0	0	1	1	What is the best way to progress in life?	q
2199	22641	0	0	0	1	1	What is the best way to quit my job?	q
2200	22642	0	0	8	8	1	What is the best way to read the CSV data from an URL and storing the feed in the MongoDB using Python?	q
2201	22643	0	0	8	8	1	What is the best way to relax sore muscles?	q
2202	22644	0	0	8	8	1	What is the best way to remember?	q
2203	22645	0	0	0	1	1	What is the best way to remove glue from a keyhole?	q
2204	22646	8	0	0	0	1	What is the best way to remove vagina hair neatly?	q
2205	22647	0	0	8	8	1	What is the best way to reset a Netgear router?	q
2206	22648	0	0	8	8	1	What is the best way to save, store and organize digital photos?	q
2207	22649	0	0	8	8	1	"What is the best way to say ""Thank you""?"	q
2208	22650	0	0	8	8	1	What is the best way to scan a document into a computer?	q
2209	22651	0	0	0	0	1	What is the best way to sell a domain name?	q
2210	22652	0	0	0	1	1	What is the best way to send money from Australia to the Philippines?	q
2211	22653	0	0	8	8	1	What is the best way to spend a weekend in Mumbai?	q
2212	22654	0	0	8	8	1	What is the best way to start a conversation with a girl in a college?	q
2213	22655	0	0	0	0	1	What is the best way to stay young after 50?	q
2214	22656	0	0	8	8	1	What is the best way to study for C.A. exams?	q
2215	22657	0	0	8	8	1	What is the best way to succeed in Clash of Clans?	q
2216	22658	0	0	8	8	1	What is the best way to sweep someone off their feet?	q
2217	22659	0	0	8	8	1	What is the best way to throw a party?	q
2218	22660	0	0	8	8	1	What is the best way to to make money?	q
2219	22661	0	0	8	8	1	What is the best way to track your mobile via IMEI in India?	q
2220	22662	0	0	8	8	1	What is the best way to treat the flu?	q
2221	22663	0	0	8	8	1	What is the best way to unlock smartphone?	q
2222	22664	0	0	0	0	1	What is the best way to use tinder?	q
2223	22665	0	0	0	1	1	What is the best way to write algorithms?	q
2224	22666	0	0	8	8	1	What is the best website design company?	q
2225	22667	0	0	0	1	1	What is the best website for consumer product reviews?	q
2226	22668	0	0	8	8	1	What is the best website or place to start blogging?	q
2227	22669	0	0	8	8	1	What is the best weight loss method?	q
2228	22670	0	0	8	8	1	What is the best weight loss supplements for womens?	q
2229	22671	1	0	8	8	1	What is web scraping and is Python the best language to use for this?	q
2230	22672	0	0	8	8	1	What is, in your opinion, the best book cover ever?	q
2231	22673	1	0	8	8	1	What marinades are the best for tenderizing pork chops?	q
2232	22674	0	0	8	8	1	"What should be the best reply to the interview question ""What is your professional development plan""?"	q
2233	22675	0	0	8	8	1	What should be the best resume title for b.tech fresher in electronics and communication?	q
2234	22676	1	0	8	8	1	What sites are the best to watch English movies?	q
2235	22677	1	0	0	1	1	What smart watch would be the best for people who are active, want a good looking watch, and has a good software?	q
2236	22678	1	0	8	8	1	What three websites have the best user experiences?	q
2237	22679	0	0	0	0	1	What was the best advice you've ever received?	q
2238	22680	0	0	8	8	1	What was the best episode of Friends?	q
2239	22681	0	0	8	8	1	What were the best movies of 2015? Why?	q
2240	22682	0	0	0	1	1	"What will be the best answer for ""Why do you want to leave your current organization ?"""	q
2241	22683	0	0	8	8	1	What will be the best SEO strategies?	q
2242	22684	0	0	8	8	1	What will be the best thing to loose weight? I have thyroid due to which I have severe backaches, and I am not able to workout more.	q
2243	22685	0	0	8	8	1	What would be the best heating and air unit to put in a trailer , 16 x 80	q
2244	22686	0	0	8	8	1	What would be the best way to control anger?	q
2245	22687	0	0	8	8	1	What would be the best way to use Facebook usefully?	q
2246	22688	0	0	8	8	1	What's the best age to lose virginity for a woman?	q
2247	22689	0	0	8	8	1	What's the best car for a realtor under 5k?	q
2248	22690	1	0	8	8	1	What's the best case scenario for peace between Israel and Palestine in the next decade?	q
2249	22691	0	0	8	8	1	What's the best cell phone carrier?	q
2250	22692	0	0	8	8	1	What's the best coffee?	q
2251	22693	0	0	0	1	1	What's the Best Drink You've Ever Had?	q
2252	22694	1	0	8	8	1	What's the best economics textbook for self-study?	q
2253	22695	0	0	0	1	1	What's the best fantasy book?	q
2254	22696	0	0	8	8	1	What's the best field to build and sell a business in?	q
2255	22697	0	0	8	8	1	What's the best laptop I can buy as a CS student?	q
2256	22698	0	0	8	8	1	What's the best Linux operating System distro for beginners?	q
2257	22699	0	0	0	0	1	What's the best method to get meth out of your system?	q
2258	22700	0	0	8	8	1	What's the best method to lucid dreaming?	q
2259	22701	0	0	8	8	1	What's the best mistake you've ever made?	q
2260	22702	0	0	8	8	1	What's the best pickup line you have heard?	q
2261	22703	0	0	8	8	1	What's the best processor?	q
2262	22704	1	0	8	8	1	What's the best programming language for developing websites?	q
2263	22705	0	0	0	0	1	What's the best real life karma you've ever seen/experienced?	q
