	id	aspect	direct	factual	opinion	comp	question	dataset
0	11	1	0	1	0	1	What’s the least common multiple of 5 and 150	g
1	23	1	0	1	0	1	what is a common reason to file a suspicious activity report	g
2	184	0	1	1	0	1	What isan important difference between cpi and the gdp deflator is	g
3	266	1	0	1	0	1	What are the top 10 best songs with over a billion views	g
4	290	1	0	0	0	1	which idea best describes an element of an unlimited government	g
5	316	1	0	1	0	1	which statement best describes the slaves in ancient athens	g
6	337	0	0	0	0	1	what are the different political parties in the united states	g
7	348	1	0	1	0	1	which term best describes the type of government the united states has	g
8	349	1	0	0	1	1	who is best known for his advocacy of laissez-faire as the guiding principle for economic policy	g
9	352	1	0	0	1	1	who is the artist best known for the color purple	g
10	371	0	1	0	1	1	which is better holiday inn or white christmas	g
11	409	0	1	0	1	1	why precision rectifier is better than ordinary rectifier	g
12	410	1	1	1	0	1	which stadium is bigger real madrid or barcelona	g
13	425	0	0	1	0	1	what is the second biggest ship in the world	g
14	444	0	1	0	1	1	how close is an alaskan malamute to a wolf	g
15	523	0	0	0	0	1	what is common among all rr lyrae stars	g
16	536	0	1	1	0	1	what is common to ostrich emu and kiwi	g
17	579	0	1	1	0	1	how does the jewish calendar compared to our calendar	g
18	589	1	1	1	0	1	what is the effect of full annealing compared to normalizing	g
19	645	0	1	1	0	1	What is the difference between 38 special and 38 long colt	g
20	660	0	1	1	0	1	What is the difference between an o ring and x ring chain	g
21	691	0	1	1	0	1	What is the difference between arithmetic logic unit and control unit	g
22	698	0	1	1	0	1	What is the difference between common method variance and common method bias	g
23	699	0	1	1	0	1	What is the difference between grade i and grade ii listed buildings	g
24	705	0	1	1	0	1	What is the difference between half rate and full rate in gsm	g
25	710	0	1	1	0	1	What is the difference between hiatal hernia and sliding hiatal hernia	g
26	716	0	1	1	0	1	What is the difference between jellyfish and portuguese man of war	g
27	747	0	1	0	1	1	'is a bachelor''s degree the same as an honours degree'	g
28	762	0	1	1	0	1	What is the difference between joint stock company and company in india	g
29	820	0	1	1	0	1	What is the difference between judge and justice of the peace	g
30	833	0	1	1	0	1	What is the difference between magnetic south pole and geographic north pole	g
31	848	0	1	1	0	1	What is the difference between material safety data sheet and safety data sheet	g
32	863	0	1	1	0	1	What is the difference between neuromuscular junction and motor end plate	g
33	897	0	1	1	0	1	What is the difference between pin diode and pn junction diode	g
34	914	0	1	1	0	1	What is the difference between preparatory and payoff phase of glycolysis	g
35	915	0	1	1	0	1	What is the difference between safety relief valve and pressure relief valve	g
36	972	0	1	1	0	1	What is the difference between single cut and double cut files	g
37	1044	0	1	1	0	1	What is the difference between standing wave flume and venturi flume	g
38	1065	0	1	1	0	1	What is the difference between top of the lake and china girl	g
39	1067	0	1	1	0	1	what is difference between north america and south america	g
40	1093	0	1	1	0	1	how are red giants different from main sequence stars	g
41	1099	0	1	1	0	1	in what way is the soil in the delta of the river ganga different from that of the river godavari	g
42	1105	1	0	0	0	1	what was different about the election of 1920 concerning the 19th amendment	g
43	1142	0	1	1	0	1	why is the length of a lunar day different from the length of a solar day	g
44	1231	0	0	1	0	1	'who was india''s first woman judge in supreme court'	g
45	1244	1	0	1	0	1	Who was the first african american gymnast to go to the olympics	g
46	1280	1	0	1	0	1	Who was the first first european known to have crossed the mississippi river (2 wds.)	g
47	1313	1	0	1	0	1	'who was india''s first olympic medal win as a free nation'	g
48	1331	1	1	1	0	1	what was made first disneyland or disney world	g
49	1358	0	1	1	0	1	which book is first the davinci code or angels and demons	g
50	1369	1	1	1	0	1	which came first tcp/ip or osi	g
51	1392	1	1	1	0	1	which was a state first arkansas or kansas	g
52	1399	1	0	1	0	1	who built first airplanes for the united states navy in 1913	g
53	1401	0	1	0	0	1	is the riddler and the joker the same character	g
54	1415	1	0	1	0	1	who did the patriots play first this season	g
55	1425	1	0	1	0	1	'who recorded country music''s first big hit million seller record and what was the name of the song'	g
56	1436	0	1	1	0	1	who was first doctor fate or doctor strange	g
57	1448	0	1	0	0	1	what are two ways the caravel was different from other boats of its time	g
58	1450	0	0	1	0	1	what are the waves in order from smallest to biggest	g
59	1486	1	0	1	0	1	What is the highest exporter of natural gas in the middle east	g
60	1535	1	0	1	0	1	What are the highest grossing movies of all time in philippines	g
61	1540	1	0	1	0	1	What is the highest number of test wickets by fast bowler	g
62	1595	1	0	1	0	1	what is lebron james highest score in one game	g
63	1611	1	0	1	0	1	Which are the five largest states in the us by area	g
64	1619	1	0	1	0	1	What are the largest companies in the united states by market cap	g
65	1657	0	0	0	0	1	what are the different types of combustion engines	g
66	1672	1	0	1	0	1	What is the largest country in the world by land area	g
67	1692	0	0	1	0	1	What is sequoia national park largest tree in the world	g
68	1702	1	0	1	0	1	What are three largest cities in the world by population	g
69	1720	1	0	1	0	1	What are the top ten largest cities in canada by population	g
70	1749	0	0	1	0	1	what are the three largest cities in japan	g
71	1752	0	0	1	0	1	what are the three largest cities in mississippi	g
72	1770	0	0	1	0	1	'where is the world''s largest aquarium located'	g
73	1805	0	0	1	0	1	'who has the world''s largest standing army'	g
74	1818	1	0	1	0	1	Who was the last person to win triple crown in baseball	g
75	1858	1	0	1	0	1	who became athens leading philosopher during its golden age	g
76	1878	1	0	1	0	1	which letter of the english alphabet occurs least often in writing	g
77	1882	1	0	1	0	1	What is longest continuously serving female mp in house of commons	g
78	1902	1	0	1	0	1	what is the second longest running broadway show	g
79	1914	1	0	1	0	1	what is the trail blazers longest winning streak	g
80	1951	1	0	1	0	1	who has held the office of chief ministers for longest term	g
81	1953	1	0	1	0	1	who served as the union cabinet minister of agriculture for longest duration	g
82	1958	1	0	1	0	1	What is the state state with low level of urbanisation in india	g
83	1969	1	0	1	0	1	during what time of the year is the arctic sea ice extent normally at its lowest	g
84	2046	0	0	1	0	1	what are 2 major nascar events that occur in daytona beach	g
85	2047	1	0	1	0	1	who has scored many goals in the world cup 2018	g
86	2064	1	0	1	0	1	density of water is maximum at which temperature	g
87	2082	1	0	1	0	1	who has won maximum oscar in his lifetime	g
88	2096	1	1	1	0	1	does hong kong have more skyscrapers than new york	g
89	2112	1	0	0	1	1	what type of rainfall is more common in india and why	g
90	2130	1	1	1	0	1	who has more fans manchester united or city	g
91	2158	1	1	1	0	1	who has more nba championships the east or west	g
92	2163	1	1	1	0	1	who has played more games ronaldo or messi	g
93	2175	1	1	1	0	1	who has won more civil wars ducks or beavers	g
94	2186	1	1	1	0	1	who has won more games packers or bears	g
95	2214	0	0	0	0	1	who became the first leader of the united russia	g
96	2231	1	1	1	0	1	who has won more world series american or national	g
97	2246	1	1	1	0	1	who sold more albums carrie underwood vs kelly clarkson	g
98	2248	1	1	1	0	1	who sold more albums elvis or michael jackson	g
99	2262	1	1	1	0	1	who sold more records elvis or the beatles	g
100	2269	1	1	1	0	1	who won more el clasico real madrid or barcelona	g
101	2283	1	1	1	0	1	who won more matches barcelona vs real madrid	g
102	2296	1	1	1	0	1	why was immigration through angel island more difficult than immigration through ellis island	g
103	2298	1	0	1	0	1	Who is a defender with most goals in premier league 2016/17	g
104	2299	1	0	1	0	1	in what section of the country were most of the states with low populations of immigrants located	g
105	2306	1	0	1	0	1	in which country of east asia are earthquakes most frequent	g
106	2317	1	0	1	0	1	What are lebron james most field goal attempts in a game	g
107	2325	1	0	1	0	1	Who had the most assists in an nba game by a team	g
108	2377	0	0	1	0	1	What are the most points in one nba game single player	g
109	2430	1	0	0	0	1	when does it rain the most in scotland	g
110	2469	0	0	1	0	1	What are the most rushing yards in a game by a player	g
111	2473	1	0	1	0	1	What is the most up to date version of internet explorer	g
112	2501	1	0	1	0	1	What is the second most expensive car in the world	g
113	2510	1	0	0	0	1	to what humanist from florence is the development of renaissance individualism most closely linked	g
114	2521	1	0	1	0	1	What are the top 10 most popular name in the world	g
115	2565	1	0	1	0	1	what movie holds the record for most money made in an opening weekend	g
116	2596	1	0	1	0	1	what type of bond is most likely for two atoms with valences of 1 and 7	g
117	2606	0	0	0	1	1	what type of rock would most	g
118	2608	1	0	0	1	1	'what vincent van gogh''s most famous painting'	g
119	2619	1	0	0	1	1	'what would you consider the three most important facts about pakistan''s neighbors'	g
120	2635	1	0	1	0	1	'what''s the record for most points scored in nba game'	g
121	2668	1	0	1	0	1	where are most nitrogen compounds excreted from humans	g
122	2684	1	0	1	0	1	'where are most of the world''s earthquakes located'	g
123	2686	1	0	1	0	1	where do most immigrants come from to australia	g
124	2715	1	0	1	0	1	'where do most of kenya''s population live'	g
125	2723	1	0	1	0	1	where do most shark attacks happen in the united states	g
126	2728	1	0	1	0	1	where does most farming take place in china	g
127	2730	1	0	1	0	1	'where does most of canada''s electricity come from'	g
128	2738	1	0	1	0	1	where does most of the wood come from	g
129	2740	1	0	1	0	1	where does most seismic activity occur on earth	g
130	2770	0	0	1	0	1	'what''s the latest season of big bang theory'	g
131	2774	1	0	0	0	1	where is eureka college located and who is easily its most notable alumni	g
132	2785	1	0	1	0	1	'where is most of brazil''s population located'	g
133	2790	1	0	1	0	1	'where is most of canada''s hydroelectric power generated'	g
134	2803	1	0	1	0	1	where is most of the agriculture practiced on earth	g
135	2814	1	0	1	0	1	where were most british textile mills located in 1850	g
136	2820	1	0	0	1	1	where would a particle in the first excited state of an infinite well most likely be found	g
137	2833	1	0	1	0	1	which agar will grow most types of neisseria	g
138	2848	1	0	0	1	1	which group did most of the work on the latifundia	g
139	2849	1	0	1	0	1	which life stage of the honey bee is most commonly fed upon by the varroa mite	g
140	2874	1	0	1	0	1	which of the following pieces of legislation is most important to dsca	g
141	2897	1	0	0	1	1	which western export has been most welcomed throughout the modern world	g
142	2911	1	0	1	0	1	who are the parsis and where do most of them live today	g
143	2933	1	0	1	0	1	who has most number of goals in football	g
144	2947	1	0	1	0	1	who has scored most goals in international football	g
145	3002	1	0	1	0	1	who has sung most number of songs in india	g
146	3009	1	0	1	0	1	who has the record for most superbowl rings	g
147	3024	1	0	1	0	1	who holds the record for most christmas number 1s	g
148	3025	1	0	1	0	1	who holds the record for most consecutive wins in the nba	g
149	3056	1	0	1	0	1	who holds the record for most home runs in a single season	g
150	3065	1	0	1	0	1	who holds the record for most home runs in major league baseball	g
151	3074	1	0	1	0	1	who holds the record for most rushing yards in a game	g
152	3076	1	0	1	0	1	who is on the world most wanted list	g
153	3107	1	0	1	0	1	who scored most goals in a premier league season	g
154	3129	1	0	0	0	1	who was most adversely affected by the price revolution	g
155	3137	1	0	0	1	1	who was most responsible for the second part of cell theory (that cells come from previous cells)	g
156	3150	1	0	1	0	1	who wrote most of the songs for the beatles	g
157	3174	0	0	0	0	1	what was the first public school in america	g
158	3177	1	0	1	0	1	What is the nearest metro station to sarita vihar apollo hospital	g
159	3190	0	1	1	0	1	which is older jeopardy or wheel of fortune	g
160	3221	1	0	1	0	1	Who is oldest female tennis player to win a major	g
161	3230	0	0	1	0	1	who is oldest living baseball hall of famer	g
162	3248	1	0	1	0	1	which religion predominates in the countries of pakistan and bangladesh	g
163	3277	1	0	0	1	1	which modulation scheme is preferred for dsss process	g
164	3284	1	1	0	1	1	why is bronze preferred over copper metal for making statues	g
165	3320	1	0	1	0	1	where does the us rank in world healthcare	g
166	3338	1	0	0	0	1	who is the top us male figure skater competing for team usa	g
167	3353	0	0	1	0	1	who is ranked 1 in the big 12	g
168	3399	0	0	1	0	1	What is a record number of overtime periods in nhl playoffs	g
169	3415	0	0	1	0	1	what are the 10 richest states in america	g
170	3416	1	0	0	0	1	who served as chief minister of balochistan for shortest period	g
171	3432	0	1	1	0	1	how are the american declaration of independence and french declaration of the rights of man similar	g
172	3449	0	1	1	0	1	In what are the new york state constitution and the us constitution similar	g
173	3460	0	1	1	0	1	what are some similarities between judaism and hinduism	g
174	3480	0	0	1	0	1	what is the second strongest typhoon in the philippines	g
175	3493	0	0	1	0	1	what is the latest version of photoshop cs6	g
176	3495	0	0	1	0	1	what is the 2nd largest city in usa	g
177	3525	1	0	0	1	1	is jimmy anderson the best bowler in the world	g
178	3529	1	0	0	1	1	what is the best alternative energy source to replace fossil fuels	g
179	3541	1	0	1	0	1	what is the best selling ea sports game	g
180	3545	1	0	0	1	1	where do the best quality emeralds come from	g
181	3548	1	0	0	1	1	where does the best quality silk come from	g
182	3568	0	0	0	1	1	where is the best soil in the us	g
183	3581	0	0	0	1	1	which is the best description of the settlers in the early days of the virginia colony	g
184	3583	0	0	0	1	1	which is the best reason for not using the family car as a reference point	g
185	3606	1	0	0	1	1	which organization is the best known international intergovernmental organization of igo	g
186	3612	1	0	0	1	1	who has the best history in english football	g
187	3616	1	0	1	0	1	who has the best nba record this season	g
188	3617	1	0	1	0	1	who has the best record of the chasers	g
189	3623	1	0	1	0	1	who have the best record in the nba	g
190	3628	0	0	1	0	1	who is the best nba player of all time	g
191	3630	0	0	1	0	1	who was the best player in 2010 world cup	g
192	3638	1	0	1	0	1	what are the biggest sources of revenue for the federal government	g
193	3645	0	0	1	0	1	what is the biggest contribution of meralco in luzon	g
194	3648	0	0	1	0	1	what is the biggest john deere tractor in the world	g
195	3672	0	0	0	0	1	what are the different parts that make up blood	g
196	3689	0	0	1	0	1	what is the biggest super volcano on earth	g
197	3696	0	0	1	0	1	what was the biggest battle in the american revolution	g
198	3733	0	0	1	0	1	what was the biggest win in nba history	g
199	3735	0	0	1	0	1	'what''s the biggest stadium in the us'	g
200	3738	0	0	1	0	1	where is the biggest waterfall in the united states	g
201	3739	1	0	1	0	1	where was the biggest great white shark found	g
202	3772	1	0	1	0	1	which airport is the biggest in the united states	g
203	3784	0	0	1	0	1	which is the biggest state in the united states of america	g
204	3794	0	0	1	0	1	which is the biggest word in english dictionary	g
205	3810	1	0	1	0	1	who had the biggest thighs in the nfl	g
206	3818	1	0	1	0	1	who has the biggest brain in the world	g
207	3824	1	0	1	0	1	who has the biggest ship on deadliest catch	g
208	3844	0	0	1	0	1	what is the busiest hurricane season on record	g
209	3880	0	0	0	0	1	what is the central aim of the paris agreement	g
210	3886	0	0	1	0	1	what is the coldest temperature recorded in new york state	g
211	3919	0	0	1	0	1	where is the deepest part of lake geneva	g
212	3922	0	0	1	0	1	which is the deepest hole in the world	g
213	3927	0	1	1	0	1	what are the difference between a shared pair and an unshared pair of electrons	g
214	3978	0	1	1	0	1	What is the difference between a nova and an x-ray burst	g
215	3979	0	1	1	0	1	What is the difference between house of representatives and senate	g
216	3988	0	0	1	0	1	What is the difference in the college 3 point line in nba	g
217	3999	0	1	1	0	1	what is the difference between a bernese mountain dog and a swiss mountain dog	g
218	4017	0	1	1	0	1	what is the difference between a lawyer and an attorney in south africa	g
219	4022	0	1	0	1	1	what is the difference between a lie and an exaggeration	g
220	4026	0	1	1	0	1	what is the difference between a measurement and an observation	g
221	4037	0	1	1	0	1	what is the difference between a state senator and a united states senator	g
222	4051	0	1	1	0	1	what is the difference between a valley and a hollow	g
223	4052	0	1	1	0	1	what is the difference between air brakes and hydraulic brakes	g
224	4057	0	1	1	0	1	what is the difference between ampa receptors and nmda receptors	g
225	4065	0	1	1	0	1	what is the difference between an equivalency credit and a course challenge	g
226	4070	0	1	1	0	1	what is the difference between ansi lumens and lumens	g
227	4087	0	1	0	0	1	what is the difference between baptist church and christian church	g
228	4091	0	1	0	0	1	what is the difference between bn and bsc nursing	g
229	4093	0	1	1	0	1	what is the difference between c5 and c6 christmas lights	g
230	4127	0	1	1	0	1	what is the difference between canapes and hors d oeuvres	g
231	4139	0	1	1	0	1	what is the difference between cape and csec	g
232	4144	0	1	1	0	1	what is the difference between cardinal and intermediate directions	g
233	4157	0	1	1	0	1	what is the difference between department and directorate	g
234	4164	0	1	1	0	1	what is the difference between donald duck and daffy duck	g
235	4167	0	1	0	1	1	what is the difference between east and west coast rap	g
236	4168	0	1	1	0	1	what is the difference between jpmorgan and jpmorgan chase	g
237	4170	0	1	1	0	1	what is the difference between king and lord	g
238	4171	0	1	1	0	1	what is the difference between scene and act	g
239	4193	0	1	1	0	1	what is the difference between staff of asclepius and caduceus	g
240	4204	0	1	1	0	1	what is the difference between teller 1 2 and 3	g
241	4215	0	1	1	0	1	what is the difference between type 1 and type 2 seyfert galaxies	g
242	4218	0	1	1	0	1	what is the difference between yahweh and adonai	g
243	4223	0	1	1	0	1	what the difference between european cup and champions league	g
244	4232	0	1	1	0	1	'what''s the difference between a nucleotide and a nucleoside'	g
245	4251	0	1	1	0	1	'what''s the difference between a proclamation and a declaration'	g
246	4267	0	1	1	0	1	'what''s the difference between a specialist and a generalist'	g
247	4269	0	1	1	0	1	'what''s the difference between cbc and fbc'	g
248	4307	0	1	1	0	1	'what''s the difference between de jure and de facto'	g
249	4318	0	1	1	0	1	'what''s the difference between lord and sir'	g
250	4325	0	1	1	0	1	'what''s the difference between minecraft story mode and the complete adventure'	g
251	4352	0	1	1	0	1	'what''s the difference between pvz free and pvz'	g
252	4354	0	1	1	0	1	'what''s the difference between shazam and black adam'	g
253	4363	0	1	1	0	1	What’s the difference between texas holdem and poker	g
254	4372	0	0	1	0	1	what are the differences in windows 10 versions	g
255	4417	1	0	1	0	1	what are the different types of t cells and their functions	g
256	4418	0	0	1	0	1	what do the different pedals on a piano do	g
257	4421	0	0	1	0	1	what is the dominant climate type for san diego	g
258	4423	1	0	1	0	1	who won the espy for best nba player	g
259	4444	1	0	1	0	1	who holds the record for the farthest home run	g
260	4445	1	0	1	0	1	who has the faster internet in the world	g
261	4446	0	0	1	0	1	What is the fastest car in the world street legal	g
262	4458	0	0	1	0	1	which is the fastest running train on indian railways	g
263	4498	1	0	1	0	1	who has the fastest 40 yard dash time at the nfl combine	g
264	4515	1	0	1	0	1	who has the fastest serve in female tennis	g
265	4518	1	0	0	1	1	who has the fastest slapshot in the nhl	g
266	4526	1	0	1	0	1	who has the fastest time in the nfl combine	g
267	4544	1	0	1	0	1	who scored the fastest century in ipl 2008	g
268	4569	1	0	1	0	1	What is the first intelligence test to include a non-verbal scale as a measure of human intelligence	g
269	4595	1	0	1	0	1	in which country the first submarine was made	g
270	4632	1	0	1	0	1	what city is the first to celebrate new years	g
271	4643	0	0	1	0	1	what was the first theme park in disney world	g
272	4646	0	0	1	0	1	what were the first multi-cellular animals on earth	g
273	4661	1	0	1	0	1	which english comedian became the first moomba king in 1967	g
274	4662	0	0	1	0	1	which is the first hindi movie in india	g
275	4679	1	0	1	0	1	which us city created the first formal us police department	g
276	4681	0	0	1	0	1	who became the first high priest of israel	g
277	4683	0	0	1	0	1	who became the first spokesperson for non-violent protests	g
278	4714	0	0	1	0	1	who become the first president of the bharatiya janata party	g
279	4729	0	0	1	0	1	'who become the first woman head india''s external affairs ministry'	g
280	4747	1	0	1	0	1	who established the first trade settlement of the english in india	g
281	4751	1	0	1	0	1	who fired the first shot at fort sumter	g
282	4759	1	0	1	0	1	who fired the first shot in the civil war	g
283	4763	1	0	1	0	1	who invented the first radio and what year	g
284	4770	0	0	1	0	1	who is considered as the first film actress of sinhala cinema	g
285	4774	0	0	1	0	1	who is considered to be the first leftist historian of india	g
286	4776	0	0	1	0	1	who is considered to be the first pope of the christian church	g
287	4829	0	0	1	0	1	who is said to be the first modern archaeologist	g
288	4831	0	0	1	0	1	who is the first athlete getting arjun award	g
289	4848	0	0	1	0	1	who is the first lady prime minister of india and what has she done for your country	g
290	4855	1	0	1	0	1	who is the first listened to on spotify	g
291	4857	0	0	1	0	1	who is the first president of bharatiya janata party	g
292	4858	1	0	1	0	1	who is the first woman boxer to be honoured with the rajiv	g
293	4869	0	0	1	0	1	who is the first woman nominated members of the rajya sabha	g
294	4878	0	0	1	0	1	who landed on the moon for the first time	g
295	4885	1	0	1	0	1	who made the first 1911 semi automatic pistol	g
296	4907	1	0	1	0	1	who made the first tv in the world	g
297	4911	0	0	1	0	1	who was the first actor who played james bond	g
298	4915	0	0	1	0	1	who was the first african american elected to the united states senate	g
299	4923	1	0	1	0	1	'who was the first african american to play in baseball''s major leagues'	g
300	4943	0	0	0	0	1	who was the first african minister in kenya	g
301	4944	1	0	1	0	1	who was the first canadian to win an olympic gold medal while competing for canada	g
302	4946	0	0	0	0	1	who was the first caption of india cricket team	g
303	4955	1	0	1	0	1	who was the first child star signed to motown	g
304	4975	0	0	1	0	1	who was the first civilian governor of lagos state	g
305	4979	1	0	1	0	1	who was the first common man to be elected president of the united states	g
306	4985	1	0	8	8	1	who was the first documented person to be born on the continent of antarctica	g
307	4993	0	0	1	0	1	who was the first governor of california after statehood	g
308	4999	0	0	0	0	1	who was the first hero of the philippines	g
309	5005	0	0	1	0	1	who was the first home minister of india	g
310	5034	1	0	1	0	1	who was the first indian actress to receive the padma shri award	g
311	5078	1	0	0	0	1	who was the first indian film maker to be honoured with the magsaysay award	g
312	5110	0	0	1	0	1	who was the first inspector general of forests in india why was he appointed	g
313	5133	0	0	1	0	1	who was the first joseph in joseph and the technicolor dreamcoat	g
314	5150	1	0	1	0	1	who was the first living indian to feature of postage stamp of india	g
315	5173	1	0	1	0	1	who was the first man to travel in space	g
316	5174	0	0	1	0	1	who was the first man who climbed mount everest	g
317	5181	0	0	1	0	1	who was the first official president of the united states	g
318	5183	1	0	1	0	1	who was the first one to win american idol	g
319	5213	1	0	1	0	1	who was the first patient to have an islet cell transplant for diabetes	g
320	5230	0	0	1	0	1	who was the first person found not guilty by reason of insanity	g
321	5239	0	0	1	0	1	who was the first person rogue used her powers on	g
322	5268	0	0	1	0	1	who was the first person that played batman	g
323	5270	1	0	1	0	1	who was the first person to be baptized in the bible	g
324	5275	1	0	1	0	1	who was the first person to be inducted into the rock and roll hall of fame	g
325	5297	1	0	0	1	1	who was the first person to ever get arrested	g
326	5310	1	0	1	0	1	who was the first person to have raised the indian flag on foreign soil and where	g
327	5313	0	0	1	0	1	who was the first person who invented microscope	g
328	5317	1	0	1	0	1	who was the first player in bb history to return to the game after being evicted	g
329	5335	1	0	1	0	1	who was the first president to be awarded the nobel peace prize	g
330	5341	1	0	1	0	1	who was the first president to call his residence the white house	g
331	5364	0	0	1	0	1	who was the first serial killer in america	g
332	5380	1	0	1	0	1	who was the first to be known for using methods of nonviolent civil disobedience in protest	g
333	5396	0	0	1	0	1	who was the first woman elected to the accounting hall of fame	g
334	5406	0	0	0	0	1	who was the first woman elected to the us senate	g
