	id	aspect	direct	factual	opinion	comp	question	dataset
3170	28362	8	8	0	0	1	What are some of the more lesser known and unique locations throughout Germany to visit?	q
3171	28381	8	8	8	8	1	What are some really interesting machine learning projects for beginners?	q
3172	28505	8	8	0	1	1	What are the benefits and drawbacks of applying aloe vera on the face in the night before sleeping?	q
3173	28506	8	8	0	1	1	What are the benefits of a liberal Arts education?	q
3174	28507	8	8	8	8	1	What are the benefits of a rainforest?	q
3175	28508	8	8	0	1	1	What are the benefits of advertising on social media?	q
3176	28509	8	8	8	8	1	What are the benefits of developing in Node.js versus Python?	q
3177	28510	8	8	0	1	1	What are the benefits of fish oil?	q
3178	28511	8	8	8	8	1	What are the benefits of government job?	q
3179	28512	8	8	0	1	1	What are the benefits of having sex?	q
3180	28513	8	8	8	8	1	What are the benefits of pranic healing?	q
3181	28514	8	8	8	8	1	What are the benefits of reciting Hanuman Chalisa?	q
3182	28515	8	8	8	8	1	What are the benefits of wearing rudraksha or spatik (quartz crystal) mala?	q
3183	28542	8	8	8	8	1	What are the different blood groups?	q
3184	28543	8	8	8	8	1	What are the different kinds of math?	q
3185	28544	8	8	0	0	1	What are the different pay scales and grade pay for government jobs in India and what do they mean?	q
3186	28545	8	8	8	8	1	What are the different programming platforms for Java?	q
3187	28546	8	8	8	8	1	What are the different terrestrial animals? How do they live and adapt to their enviroment?	q
3188	28547	8	8	8	8	1	What are the different types of gear?	q
3189	28548	8	8	8	8	1	What are the different types of server caching?	q
3190	28571	8	8	8	8	1	What are the funniest jokes / stories you ever heard?	q
3191	28676	1	1	8	8	1	If Barack Obama ran against Donald Trump who would win the presidential election?	q
3192	28692	8	8	8	8	1	What are the top UK companies that sponsor employment visas?	q
3193	28697	8	8	8	8	1	What are the various benefits and challenges of using commercial Basic dialects like PureBasic or RealBasic to create production software?	q
3194	28930	1	1	8	8	1	Who would win in a 1v1 fight? A longbowman or a knight?	q
3195	29212	8	8	0	0	1	What is a Good 3ds Rom site?	q
3196	29325	0	1	8	8	1	Who would I choose? The person who love me but I don't love, or the person who I love but doesn't love me?	q
3197	29352	8	8	0	0	1	What is friction and what are the different types?	q
3198	29728	8	8	8	8	1	What is the largest number that can be formed using four 3's.	q
3199	29730	8	8	8	8	1	What is the leading online shopping website in Middle East nowadays?	q
3200	29814	1	0	8	8	1	Who do you think would win the 2016 USA Election?	q
3201	29818	1	1	8	8	1	Who would win an all out war between Pakistan and India if no other country got involved?	q
3202	30232	8	8	8	8	1	What song (1 song only please) generates the most emotion in you?	q
3203	30316	0	1	0	1	1	Among these EVs Nissan Leaf, Renault ZOE, Chevy Bolt and Tesla's Model 3, which would you pick and why?	q
3204	30375	8	8	8	8	1	What would be the top 10% bay area salary for PhD with 7 years experience, in different technical fields?	q
3205	30427	8	8	8	8	1	What's a good site to find students who want to learn English?	q
3206	30495	0	0	8	8	1	If you had to choose one faction from the Divergent series which one would you pick and why?	q
3207	30693	0	0	8	8	1	What is your biggest dream and what are you doing to make it your reality?	q
3208	30754	0	0	0	0	1	Which is your favourite dish and why?	q
3209	30793	8	8	0	0	1	Which sugar stocks are best to invest in? Which stocks to buy if sugar prices turn bullish?	q
3210	30856	8	8	8	8	1	Who is smarter? A scientist or philosopher?	q
3211	30886	8	8	8	8	1	Who were the most-influential architects of 1960s and 70s and their seminal works?	q
3212	30896	8	8	0	0	1	Who would win an all out war between Marvel and DC?	q
3213	31351	8	8	0	0	1	Why does Israel have the highest rank of suicide in Middle East far larger than Iran, Turkey and Arabian countries? Where is the problem?	q
3214	31617	8	8	0	0	1	Why is UK better than USA?	q
3215	31676	8	8	8	8	1	"Why was Genghis khan more popular than Tamerlane in the world as ""Mongol "" given that both are brutal conqueror and remarkable leader?"	q
4520	33151	1	1	8	1	1	What's the better way to charge for a cloud platform, simple but more expensive, or complicated but cheaper for most?	o
4521	33152	0	1	8	1	1	Which is better Haskell AND Lisp vs. Haskell OR Lisp	o
4522	33153	0	1	8	1	1	When is it better to offload work to the RDBMS rather than to do it in code?	o
4523	33154	0	1	8	1	1	Is it better to specialize in a single field I like, or expand into other fields to broaden my horizons?	o
4524	33155	0	1	8	1	1	What are the differences between Microsoft SDE Interview vs Microsoft SDET Interview and Resources to Study	o
4525	33156	0	1	8	1	1	How is IntelliJ better than Eclipse?	o
4526	33157	0	1	8	1	1	I believe my solution is better than my boss's, so should I ignore him?	o
4527	33158	1	1	8	1	1	Which Office arangement is better comfort vs. teamwork?	o
4528	33159	1	1	8	1	1	Choosing between two programmers: experience vs. passion which is better	o
4529	33160	1	1	8	1	1	When is C a better choice than C++?	o
4530	33161	1	1	8	1	1	What's the better user experience: Waiting once at startup for a long time or waiting frequently for a short time?	o
4531	33162	1	1	8	1	1	What is the difference between WPF vs. WinForms - a Delphi programmer's perspective?	o
4532	33163	0	1	8	1	1	What is the difference Python productivity VS Java Productivity	o
4533	33164	1	1	8	1	1	Which is better Haskell vs Erlang for web services	o
4534	33165	0	1	8	1	1	Is it better to load up a class with methods or extend member functionality in a local subclass?	o
4535	33166	0	1	8	1	1	If it was for you to chose Game Development vs Application Development, which will you chose?	o
4536	33167	1	1	8	1	1	Python threading vs. multiprocessing: Should I learn one before the other?	o
4537	33168	0	1	8	1	1	Is it better to have C developers learn Flash, than hire Flash guys?	o
4538	33169	0	1	8	1	1	What is the difference between Smart Pointers inside class vs Normal Pointers with Destructor	o
4539	33170	1	1	8	1	1	Which is better design: Determining if a function should execute from outside of it, or inside of it?	o
4540	33171	0	1	8	1	1	What is better making a separate temporary table or inserting directly to big table?	o
4541	33172	0	1	8	1	1	What is the difference Structured programming versus OO programming	o
4542	33173	0	1	8	1	1	"What are the differences between Rails 2.x and conventions vs. ""enterprise"" architecture"	o
4543	33174	0	1	8	1	1	How much better is Apache Solr than its non-Java competition?	o
4544	33175	1	1	8	1	1	When designing a protocol, is it better for a method to accept a single object of a specific type, or an array?	o
4545	33176	0	1	8	1	1	Which is better Platform Independency Vs Architecture Neutrality	o
4546	33177	1	1	8	1	1	"In what area is LISP's macro better than Ruby's ""ability"" to create DSL"	o
4547	33178	1	1	8	1	1	Readability vs minimalism/compactness/conciseness in language design: are they antagonistic?	o
4548	33179	0	1	8	1	1	Which is better UberSVN vs VisualSVN Server - Any experiences?	o
4549	33180	0	1	8	1	1	Is it better to document functions in the header file or the source file?	o
4550	33181	1	1	8	1	1	What do you believe is a better of method of learning languages: using books or jumping straight into a project?	o
4551	33182	1	1	8	1	1	What are the differences between  MonoTouch vs Objective-C for iPhone/iPod/iPad development	o
4552	33183	1	1	8	1	1	Building websites, which is the better approach MVP or MVC?	o
4553	33184	1	1	8	1	1	Python template engines: What are the real benifits and drawbacks to XML vs custom syntax	o
4554	33185	0	1	8	1	1	Is it better to blindly match the project requirements or to match the spirit of the project requirements	o
4555	33186	1	1	8	1	1	What's a better car, a Camry or an Accord?	o
4556	33187	0	1	8	1	1	which is better plasmaq or LCD big screen tvs?	o
4557	33188	1	1	8	1	1	what is the better way to grill outdoors: gas or charcoal?	o
4558	33189	0	1	8	1	1	which os is better windows or linux?	o
4559	33190	0	1	8	1	1	which one is better ? BMW or infinity G35?	o
4560	33191	1	1	8	1	1	What is a better way to go Roth IRA or conventional IRA?	o
4561	33192	1	1	8	1	1	Which is better for your body: orange or milk?	o
4562	33193	0	1	8	1	1	what's better study in your country or in some other one where u not belong to ?	o
4563	33194	0	1	8	1	1	what type of muisic is better reggeton (espanish muisic) or oder?	o
4564	33195	8	1	8	1	1	are boys better than girls in math???	o
4565	33196	1	1	8	1	1	is plasma or lcd tv better to the eyes (especially small kids) than regular crt tv?	o
4566	33197	0	1	8	1	1	What's better Snowboarding or Skiing?	o
4567	33198	1	1	8	1	1	Which is better option to conceive - IVF or tubal ligation reversal?	o
4568	33199	1	1	8	1	1	Is it better to buy a new or used pontoon boat for an all-recreation lake?	o
4569	33200	0	1	8	1	1	which is better pepsi or coke?	o
4570	33201	0	1	8	1	1	Which one is better XM radio or Sirus radio?	o
4571	33202	1	1	8	1	1	Do you think humans are better adapted to extreme hot or extreme cold?	o
4572	33203	0	1	8	1	1	Which is better JSP or PHP and why?	o
4573	33204	0	1	8	1	1	Which is better Linux or Microsoft?	o
4574	33205	1	1	8	1	1	Which is better for back pain-- ice or heat?	o
4575	33206	1	1	8	1	1	Which is better in terms of reliability and value for money, a C240 Sedan or C230 Coupe?	o
4576	33207	1	1	8	1	1	Do you think the country would be better off if everyone was liberal? conservative?	o
4577	33208	8	1	8	1	1	Why do lesbians or bi-sexuals or bi-curious females believe that women are better in bed than men?	o
4578	33209	0	1	8	1	1	Why is a Salt Water Swimming Pool better than a Chlorinated Pool?	o
4579	33210	1	1	8	1	1	What is better Windows or linuix(also ease of use)?	o
4580	33211	0	1	8	1	1	Which is better collegiate or professional?	o
4581	33212	0	1	8	1	1	which mp3 player is better iriver H10 or the Philips GoGear Jukebox?	o
4582	33213	1	1	8	1	1	From a tax perspective is it better to buy a prius now or in 2006?	o
4583	33214	0	1	8	1	1	which is better windows 2000 server or advanced server?	o
4584	33215	1	1	8	1	1	Is Yahoo or Google a better resource for research? What is another good resource for academic research?	o
4585	33216	0	1	8	1	1	is it better kenya or tanzania?	o
4586	33217	0	1	8	1	1	Which is better a Linux operating system over a Windows operating system?	o
4587	33218	1	1	8	1	1	Talks vs. poster presentations: Which is better for advertising your research and building research networks?	o
4588	33219	0	1	8	1	1	Which is better easy going advisor versus expert advisor and research experience	o
4589	33220	0	1	8	1	1	Is it better to have no publication than having you as second author?	o
4590	33221	0	1	8	1	1	Which is correct Ph.D. adviser or Ph.D. advisor?	o
4591	33222	1	1	8	1	1	Low-quality paper or no paper - which is better for an undergraduate in PhD admission?	o
4592	33223	0	1	8	1	1	What is the difference between Ph. D programs with coursework and those without it?	o
4593	33224	1	1	8	1	1	For graduate admissions, is it better to attend a well-known undergrad program with advanced coursework or one where I can write a bachelors' thesis?	o
4594	33225	1	1	8	1	1	Is job experience more valuable than taking more courses?	o
4595	33226	1	1	8	1	1	In which type of schools can I have better research experience in Biology, liberal arts college or large research university?	o
4596	33227	0	1	8	1	1	What makes a Bachelor's thesis different from Master's and PhD theses?	o
4597	33228	0	1	8	1	1	What is the difference between research intensive vs. research extensive universities?	o
4598	33229	1	1	8	1	1	What are the Differences in student load at liberal arts colleges vs. research universities	o
4599	33230	0	1	8	1	1	How to decide between sending paper to a specialized journal or to a journal with broader audience?	o
4600	33231	1	1	8	1	1	What are the trade-offs of working in the office versus elsewhere (as a professor)?	o
4601	33232	1	1	8	1	1	What are better chances for math grad school: graduate in three years or four?	o
4602	33233	1	1	8	1	1	Which is more important for PhD applicants — Quality or quantity of research papers?	o
4603	33234	0	1	8	1	1	Should I use recommendation letter from young professor I worked with or well-known professor I met in class?	o
4604	33235	1	1	8	1	1	Which is better Popular proprietary program or obscure open source substitute for reproducible research?	o
4605	33236	0	1	8	1	1	What is better to graduate early with average GPA, or later with better GPA?	o
4606	33237	1	1	8	1	1	Which is more beneficial prior to PhD: research experience or a second Masters degree?	o
4607	33238	1	1	8	1	1	Are there any risks down the line choosing maths vs. stats PhD programme?	o
4608	33239	1	1	8	1	1	When writing a peer review is it better protocol to quote parts of the orginal work or paraphrase?	o
4609	33240	0	1	8	1	1	Should you choose your committee members or should your advisor?	o
4610	33241	1	1	8	1	1	Is it better for a mathematical paper to have a citation or a nice theorem + another coauthor?	o
4611	33242	1	1	8	1	1	"For undergraduates, is publishing ""weak"" research better than not publishing?"	o
4612	33243	1	1	8	1	1	What factors should I consider when deciding between a general MBA vs. a specialized MBA?	o
4613	33244	0	1	8	1	1	"What is the difference between coffee grinds/beans labeled as ""espresso coffee"" and ordinary coffee?"	o
4614	33245	0	1	8	1	1	which is better Carrot Pie: custard or stew?	o
4615	33246	0	1	8	1	1	Should I preheat a pan, or start the cooking timer immediately?	o
4616	33247	0	1	8	1	1	What is the Differences between cooking a whole duck vs chicken or turkey?	o
4617	33248	1	1	8	1	1	which is better chef's knife for cutting chicken, or butcher's	o
4618	33249	0	1	8	1	1	What would be the difference between frying vs baking meatballs?	o
4619	33250	0	1	8	1	1	Is it generally better to cut chicken breast with or against the grain?	o
4620	33251	0	1	8	1	1	What is the functional difference between imitation vanilla and true vanilla extract?	o
4621	33252	1	1	8	1	1	Stock vs Broth - What's the difference in usage?	o
4622	33253	1	1	8	1	1	When baking, is it better to use a gas or electric oven?	o
4623	33254	1	1	8	1	1	Blender Buying  which is better Square vs. Round Container	o
4624	33255	8	1	8	1	1	Which is better to sauté with, stainless steel or Teflon?	o
4625	33256	0	1	8	1	1	What are the benefits of using a dedicated rice cooker, rather than just cooking rice in a pot?	o
4626	33257	0	1	8	1	1	"What is the difference between ""mince"" and ""dice""?"	o
4627	33258	0	1	8	1	1	What is the difference Pimenton ahumado vs. Pimenton de la vera	o
4628	33259	0	1	8	1	1	What are some of the benefits of electric stoves versus gas stoves?	o
4629	33260	0	1	8	1	1	What is the difference between doughnut and krapfen?	o
4630	33261	0	1	8	1	1	What is the difference between Devil's Food and Chocolate cake?	o
4631	33262	1	1	8	1	1	When curing sausage, which is more important temperature or humidity?	o
4632	33263	1	1	8	1	1	Which torch to buy for finishing sous vide meat? Butane or propane?	o
4633	33264	0	1	8	1	1	Gas or charcoal grille which one to buy	o
4634	33265	1	1	8	1	1	Are European white truffles significantly superior in flavour to those from North America?	o
4635	33266	0	1	8	1	1	What are the differences in Star free language vs. regular language	o
4636	33267	0	1	8	1	1	What's harder: Shuffling a sorted deck or sorting a shuffled one?	o
4637	33268	0	1	8	1	1	Realtime hardware/software versus PC software/hardware, how are these distinct and alike?	o
4638	33269	1	1	8	1	1	What's better for an algorithm complexity, O(log n) or amortized O(log n)?	o
4639	33270	0	1	8	1	1	Why is it seemingly easier to resume torrent downloads than browser downloads?	o
4640	33271	1	1	8	1	1	What are the differences between High Level Programming Languages vs Block Programming Environments	o
4641	33272	0	1	8	1	1	What are Advantages and disadvantages of microcoded vs hardcoded architectures	o
4642	33273	1	1	8	1	1	What is the difference in Performance of microkernel vs monolithic kernel	o
4643	33274	1	1	8	1	1	What are the Difficulty of Integer Linear Programming vs. Mixed Integer Linear Programming	o
4644	33275	1	1	8	1	1	When are binary trees better than hashtables in real world applications?	o
4645	33276	0	1	8	1	1	What is the difference between a scripting language and a normal programming language?	o
4646	33277	0	1	8	1	1	What's the difference between Adaptive Control and Hierarchical Reinforcement Learning?	o
4647	33278	1	1	8	1	1	Which Is a Better Way of Obtaining Scales, Gaussian Blur or Down Sampling?	o
4648	33279	0	1	8	1	1	Why is DPLL better than brute force?	o
4649	33280	0	1	8	1	1	Which is better Amdahl's law or gustafson's law	o
4650	33281	0	1	8	1	1	Which bound is better, a logarithmic or a polynomial with arbitrarily small degree?	o
4651	33282	1	1	8	1	1	Is a LBA with stack more powerful than a LBA without?	o
4652	33283	1	1	8	1	1	Is a 2 address machine more likely to follow a RISC or CISC design?	o
4653	33284	0	1	8	1	1	Why does a color video compress better than a black and white video?	o
4654	33285	1	1	8	1	1	Chomsky NF or Greibach NF what are the benefits for LR parser?	o
4655	33286	1	1	8	1	1	Do recursive algorithms generally perform better than their for-loop counterpart?	o
4656	33289	0	1	8	1	1	Which is faster operations on register operands or immediate operands?	o
4657	33290	0	1	8	1	1	What are the differences Kolmogorov complexity vs purposefully inefficient Turing machines	o
4658	33291	0	1	8	1	1	"What is the difference between ""deadlock prevention"" and ""deadlock avoidance"""	o
4659	33292	0	1	8	1	1	What are the differences between Multi-threading vs. Interrupt Handlers	o
4660	33293	1	1	8	1	1	Which is more fundamental: key-value or subject-predicate-object?	o
4661	33294	0	1	8	1	1	Apprenticeship vs. imitation learning - what is the difference?	o
4662	33295	0	1	8	1	1	When would best first search be worse than breadth first search?	o
4663	33296	1	1	8	1	1	Are Turing machines more powerful than pushdown automata?	o
4664	33297	1	1	8	1	1	Which is more computationally efficient: multiplication or 0 padding?	o
4665	33298	1	1	8	1	1	Can we say DFA is more efficient than NFA?	o
4666	33299	1	1	8	1	1	Is a little watering still better than no watering, when plants are thirsty?	o
4667	33300	1	1	8	1	1	Is a dethatching rake significantly better for removing thatch than a regular rake?	o
4668	33301	0	1	8	1	1	What is the difference between pure horse manure and bedding manure?	o
4669	33302	0	1	8	1	1	Tomatoes...what is the difference between early blight and late blight?	o
4670	33303	1	1	8	1	1	Are clear or opaque tarps better for solarization?	o
4671	33304	1	1	8	1	1	Would it be better for me to set up my garden in the fall, or wait until spring?	o
4672	33305	1	1	8	1	1	Is Clopyralid or Dicamba more effective in the control of clover in lawns?	o
4673	33306	1	0	8	1	1	What is a good ground cover for street frontage instead of lawn?	o
4674	33307	1	1	8	1	1	Is a potted grapevine better put under or outside a roof?	o
4675	33308	1	1	8	1	1	Why are cut roses doing so much better in a ceramic vase than a crystal vase?	o
4676	33309	0	1	8	1	1	What are the pros and cons of bagged mulch versus city mulch?	o
4677	33310	0	1	8	1	1	What are Pros and Cons of wood vs stone mulch	o
4678	33311	1	1	8	1	1	Organic or Traditional lawn fertilizer: which is safer for areas with young children?	o
4679	33312	1	1	8	1	1	Do rye or oats make a better winter cover for a poor soil vegetable garden?	o
4680	33314	1	1	8	1	1	For fruit trees, is it better to plant a single multigrafted tree, or multiple trees in one hole?	o
4681	33315	0	1	8	1	1	Is it better to pick herbs from the top or bottom of the plant?	o
4682	33316	1	1	8	1	1	Plastic Pots OR Ceramic pots, which is better in terms of plant health?	o
4683	33317	1	1	8	1	1	Is rain water better than tap water for plants?	o
4684	33318	0	1	8	1	1	Which is preferred: worm castings or worm casting tea?	o
4685	33319	1	1	8	1	1	Is mulch or topsoil better for new lawn in clay soil?	o
4686	33320	1	1	8	1	1	Are citrus trees better grown using containers or in the ground?	o
4687	33321	0	1	8	1	1	What are the pros and cons of rubber vs wood mulches?	o
4688	33322	0	1	8	1	1	Is XP mode in Windows 7 better than a regular virtual machine?	o
4689	33323	0	1	8	1	1	Which is better Windows XP (x64) vs. Windows Server 2008 (x64)	o
4690	33324	1	1	8	1	1	What filesystem to have on my USB-harddrive; FAT32 or NTFS?	o
4691	33325	0	1	8	1	1	Is it better to use a laptop on battery or on AC power?	o
4692	33326	1	1	8	1	1	What is better for GPG keys - RSA or DSA?	o
4693	33327	0	1	8	1	1	What are Pros and cons of 64bit vs 32bit Windows	o
4694	33328	0	1	8	1	1	Choosing Dual or Quad Core which is better	o
4695	33329	0	1	8	1	1	What's the difference between Wifi and Bluetooth?	o
4696	33330	1	1	8	1	1	Which one to choose for P4 Thinkpad with 1Gb (max) RAM - Windows 7 or Windows XP?	o
4697	33331	0	1	8	1	1	which is better chinese IME: Microsoft or Google?	o
4698	33332	0	1	8	1	1	What are the differences between Windows 7 RC and the RTM?	o
4699	33333	8	1	8	1	1	Should I choose 'Format' or 'Format (Quick)' when installing Windows XP?	o
4700	33335	0	1	8	1	1	Westell vs. Linksys - which one should I keep around?	o
4701	33336	0	1	8	1	1	Which is better Ubuntu vs. Mac OS	o
4702	33337	1	1	8	1	1	Why Firefox on Linux looks different than Windows/Mac?	o
4703	33338	1	1	8	1	1	Which has a better Internet connection sharing (Windows Vista/Windows 7 or Windows Vista/Ubuntu)?	o
4704	33339	0	1	8	1	1	What is the Difference between Dell's XPS and Studio XPS laptops	o
4705	33340	0	1	8	1	1	What are the differences between iTunes on the Mac and on Windows?	o
4706	33341	0	1	8	1	1	What is the difference between Sleep and Hibernate?	o
4707	33342	1	1	8	1	1	Should I use VFAT or ext3 for a 1TB external USB hard drive?	o
4708	33343	1	1	8	1	1	Should I choose 32 or 64 bit for Linux?	o
4709	33344	8	1	8	1	1	Should I change most of my money in my home country or in the destination country? baht to canadian dollars....change in thailand or canada	o
4710	33345	8	1	8	1	1	If I visit Los Angeles, am I better off renting a car or not?	o
4711	33346	1	1	8	1	1	Is it best for Canadians to get an Egyptian visa in advance or at the Cairo airport?	o
4712	33347	0	1	8	1	1	which is better Car rental in Sydney - airport or town?	o
4713	33348	1	1	8	1	1	which is better Car rental vs. buying a car for 1 month, when visiting the USA?	o
4714	33349	0	1	8	1	1	When I have the choice should I choose traveling on an Airbus 340/330 or a Boeing 777?	o
4715	33350	8	1	8	1	1	Is it cheaper to get to Cuba from Miami or Cancún?	o
4716	33351	8	1	8	1	1	Is it cheaper to buy a tour to the Galápagos Islands at home or when in Ecuador?	o
4717	33352	0	1	8	1	1	Should I book Thailand Rail tickets online (pre-trip) or at the station when I arrive?	o
4718	33353	0	1	8	1	1	Last minute flight bookings – is it better to book online or at the airport?	o
4719	33354	0	1	8	1	1	Is it cheaper and/or easier to buy a cheap tent and sleeping bag in Turkey or Bulgaria?	o
4720	33355	1	1	8	1	1	Is it better to travel by train or plane when there is risk of snow in the eastern US?	o
4721	33356	0	1	8	1	1	Which is better Self-drive vs. guided safari in Southern Africa	o
4722	33357	0	1	8	1	1	Is it better to book a car rental in advance, or once I'm in South Africa?	o
4723	33358	0	1	8	1	1	Which is better Normal LonelyPlanet guides vs. the new Discover series	o
4724	33359	1	1	8	1	1	Why is a nonstop flight sometimes more expensive than multiple connections?	o
4725	33360	0	1	8	1	1	What suitcase should I choose: hard or soft?  Canvas, polycarbonate or something else?	o
4726	33361	0	1	8	1	1	Should I buy an around the world ticket from Australia or a nearby country?	o
4727	33362	0	1	8	1	1	What is preferable, Eurail Pass or Buying Pass on the spot?	o
4728	33363	1	1	8	1	1	Biking in Arizona: which is better Homebase in Phoenix or Scottsdale?	o
4729	33364	0	1	8	1	1	What are Pros and Cons of a tent on the ground and its alternatives in Namibia	o
4730	33365	8	1	8	1	1	Travelling from London to Italy's Amalfi Coast. Better to fly or take the train?	o
4731	33366	0	1	8	1	1	What's the difference between VIP and normal sleeper-bus from Vientiane to Pakse?	o
4732	33367	0	1	8	1	1	What show is funnier, Family Guy or The Simpsons?	o
4733	33368	0	1	8	1	1	which are better... sit ups or crunches?	o
4734	33369	1	1	8	1	1	to become a richman in our life and move to good way. is a job is best or bussines is better.?	o
4735	33370	0	1	8	1	1	What’s better, the color blue or red?	o
4736	33371	1	1	8	1	1	who would you prefer to date a model or an artist?	o
4737	33372	1	1	8	1	1	What came first; Software or Hardware?	o
4738	33373	8	1	8	1	1	What is the difference between a plasma TV and LCD TV?  Which is better?	o
4739	33374	8	1	8	1	1	Which is more environmentally friendly, a hybrid or a diesel?	o
4740	33376	8	1	8	1	1	Daleep kumar or Amitab bachin is best and why?	o
4741	33377	8	1	8	1	1	What are the differences between 'compact flash',& 'memory sticks'?	o
4742	33378	8	1	8	1	1	who will win usc or texas ?	o
4743	33379	8	1	8	1	1	Who is hotter...Jessica Alba or Heather Graham?	o
4744	33380	8	1	8	1	1	What goes on first, socks or pants?	o
4745	33381	8	1	8	1	1	Which is the best AMD or INTEL?	o
4746	33382	8	1	8	1	1	What do you prefer rather kind funny guy or rich good looking guy?	o
4747	33383	8	1	8	1	1	Is smoking marijuana any better than drinking alcohol, or smoking cigarettes?	o
4748	33384	8	1	8	1	1	what do you prefer: y! messenger or skype? why?	o
4749	33385	8	1	8	1	1	Which ones better: rap or rock??	o
4750	33386	8	1	8	1	1	Who is betetr Natalie Portman or Jennifer Garner?	o
4751	33387	8	1	8	1	1	What is better?  A formal education or self-education?	o
4752	33388	8	1	8	1	1	What's more important:  Great Service or Great Price?	o
