	id	aspect	direct	factual	opinion	comp	question	dataset
1047	21478	1	0	1	0	1	Which person made a billion in a shortest period of time, and how?	q
1048	21479	1	0	8	8	1	What is a suitable inpatient drug and alcohol rehab center in Carroll County AR?	q
1049	21480	1	0	0	1	1	What is a suitable inpatient drug and alcohol rehab center in Mills County IA?	q
1050	21481	1	0	0	1	1	What is a suitable inpatient drug and alcohol rehab center near Cook County IL?	q
1051	21482	1	0	8	8	1	What is a suitable solar panel installation provider in Boulder Creek, California CA?	q
1052	21483	1	0	0	1	1	What is a suitable solar panel installation provider near San Marcos, California CA?	q
1053	21484	1	0	8	8	1	Which is a suitable inpatient drug and alcohol rehab center in Adams County CO?	q
1054	21485	1	0	8	8	1	Which is a suitable inpatient drug and alcohol rehab center in Chattooga County GA?	q
1055	21486	1	0	8	8	1	Which is a suitable inpatient drug and alcohol rehab center in Mchenry County IL?	q
1056	21487	1	0	0	1	1	Which is a suitable inpatient drug and alcohol rehab center in Park County CO?	q
1057	21488	1	0	8	8	1	Which is a suitable inpatient drug and alcohol rehab center near Upson County GA?	q
1058	21489	1	0	8	8	1	Which is a suitable inpatient drug and alcohol rehab center near White County GA?	q
1059	21490	1	0	8	8	1	Which is a suitable solar panel installation provider near Chandler, Arizona AZ?	q
1060	21491	1	0	0	1	1	Which is a suitable solar panel installation provider near Santa Ana, California CA?	q
1061	21492	1	0	8	8	1	Is there a tougher entrance exam than IIT JEE at the pre university college level on earth?	q
1062	21493	1	0	8	8	1	Where can I found adorable baked cupcakes in Gold Coast?	q
1063	21494	1	0	8	8	1	Is there an evolutionary advantage to having eyebrows?	q
1064	21495	0	1	0	0	1	PC gaming vs console gaming: What are the advantages of each platform over the other? Which is better?	q
1065	21496	0	1	0	1	1	What are Donald Trump's chances against Hillary Clinton in a general election?	q
1066	21497	1	0	0	0	1	What is an easy way make money online?	q
1067	21498	0	1	1	0	1	What is positive displacement pump and non positive displacement pump?	q
1068	21499	1	0	8	8	1	I need cab from Heathrow Terminal 5 to Paddington, is there any good cab service available?	q
1069	21500	1	1	0	1	1	Is Haskell as fast as C++? If not, why not?	q
1070	21501	0	0	0	1	1	What are some TV shows as good as Breaking Bad?	q
1071	21502	0	1	0	1	1	Is raising children in Manhattan as opposed to the suburbs a good idea?	q
1072	21503	1	1	8	8	1	Which Ivy League School's economics or MBA programs would be easier to get accepted with a low GPA but very high scores on the GMAT and TOEFL for an international applicant?	q
1073	21505	0	0	8	8	1	What are the health benefits of bacon grease?	q
1074	21507	0	1	8	8	1	Between Nike, Adidas, Reebok, and Puma, which brand is best?	q
1075	21508	0	0	0	0	1	How does a first-time founder best meet investors in Silicon Valley?	q
1076	21509	1	0	8	8	1	In web development, which language is best in regards to the database?	q
1077	21510	1	0	8	8	1	What 45 caliber Glock is best for combat?	q
1078	21511	0	0	0	0	1	What are my best career options?	q
1079	21512	0	0	8	8	1	What are some best classified websites?	q
1080	21513	0	0	0	1	1	What are some best defensive shots played by Rahul Dravid?	q
1081	21514	0	0	0	1	1	What are some best Non-Indian vegetarian food?	q
1082	21515	0	0	0	1	1	What are some best OLA / UBER hacks which can save my money?	q
1083	21516	0	0	0	1	1	What are some best revenge movies?	q
1084	21517	1	0	0	1	1	What are your best hangover hacks?	q
1085	21518	1	0	8	8	1	What are your best moments of life?	q
1086	21519	1	0	0	0	1	What do you consider your best quality?	q
1087	21520	0	0	0	1	1	What has been your best sexual experience?	q
1088	21521	1	0	8	8	1	What is BEST gaming laptops under 60000 in 2016?	q
1089	21522	0	0	8	8	1	What is best incest movie?	q
1090	21523	1	0	0	1	1	What is best interview answer (emerging startup) when asked 'What are your career goals?'	q
1091	21524	0	0	0	1	1	What is best investment option?	q
1092	21525	0	0	0	1	1	What is best Misal Pav spot in Swargate Pune area?	q
1093	21526	1	1	0	1	1	What is best source of Canadian politics news, web news sites or Facebook pages? Please be specific on which sites or pages.	q
1094	21527	0	0	0	0	1	What is best way to crack the Civil Services Exam?	q
1095	21528	0	0	0	1	1	What some best horror movies?	q
1096	21529	0	0	8	8	1	What was that best moment of your life?	q
1097	21530	1	0	8	8	1	What was your best moment?	q
1098	21531	0	0	8	8	1	What will be best laptop Under 25000 INR ?	q
1099	21532	1	0	8	8	1	What's your best travel hack?	q
1100	21533	0	0	0	1	1	Where can I find best five star hotel of Bhopal?	q
1101	21534	0	0	8	8	1	Where can I find best rat control service in Sydney?	q
1102	21535	1	0	8	8	1	Where can I found best quality graphic mats in Sydney?	q
1103	21536	0	0	8	8	1	Where can I get best children story books in Australia?	q
1104	21537	0	0	8	8	1	Where can I get best designing and printing services in Sydney for envelopes?	q
1105	21538	1	0	8	8	1	Where can I get best flavors, designs and decorations for cupcakes at Gold Coast?	q
1106	21539	0	0	0	1	1	Where can I get best quality pest control service in Australia?	q
1107	21540	1	0	0	1	1	Where can I get best street food in Bangalore?	q
1108	21541	0	0	8	8	1	Which are best apps for photo edit?	q
1109	21542	0	0	8	8	1	Which are best furniture stores in India?	q
1110	21543	0	0	8	8	1	Which Are Best Motivational Books?	q
1111	21544	1	0	0	1	1	Which book is best to use for preparing for NEET UG in 2017?	q
1112	21545	1	0	8	8	1	Which college is best for doing a B.Tech in IT at North Campus?	q
1113	21546	1	0	8	8	1	Which college is best to opt for MBA in HR in India?	q
1114	21547	1	0	8	8	1	Which colleges are best for CSE?	q
1115	21548	1	0	8	8	1	Which company network best in pune?	q
1116	21549	1	0	8	8	1	Which course after b.tech in mechanical engineering suits best?	q
1117	21550	1	0	8	8	1	Which courses are best to choose after 2nd year PUC in the field of biology?	q
1118	21551	1	0	0	1	1	Which IIT is best for aeronautical engineering?	q
1119	21552	1	0	8	8	1	Which is best antivirus for PC with Windows 10?	q
1120	21553	1	0	8	8	1	Which is best book for maths in class 10?	q
1121	21554	0	0	8	8	1	Which is Best buy out of all Jionet mobiles, budget can be managable?	q
1122	21555	0	1	8	8	1	Which is best D.U or M.D.U?	q
1123	21556	0	0	0	1	1	Which is best escort agency in Bangalore?	q
1124	21557	0	0	8	8	1	Which is best hair loss treatment clinic in Ahmedabad?	q
1125	21558	1	0	0	1	1	Which is best intermediate colleges in Hyderabad for IIT?	q
1126	21559	0	0	8	8	1	Which is best Linux distro in 2016 and why?	q
1127	21560	1	0	8	8	1	Which is best Online shopping website to buy home appliances?	q
1128	21561	0	0	8	8	1	Which is best romantic movies in tamil?	q
1129	21562	0	0	8	8	1	Which is best start up in India?	q
1130	21563	0	0	8	8	1	Which is Osho's best quote?	q
1131	21564	0	0	0	1	1	Which is Shahrukh Khan's best piece of work?	q
1132	21565	1	0	8	8	1	Which is the all time best Hollywood movie?	q
1133	21566	1	0	0	1	1	Which is the car with best pickup In Indian Hatchbacks below the price of 10 lakhs?	q
1134	21567	0	0	8	8	1	Which is world's best romantic movie?	q
1135	21568	1	0	8	8	1	Which laptop is best to buy within the range of 30000rs?	q
1136	21569	1	1	8	8	1	Which mode is best for JEE MAIN 2017 online exam or offline?	q
1137	21570	0	1	8	8	1	Which one is best among Moto G3 and Moto G Plus-4th Gen?	q
1138	21571	1	0	8	8	1	Which one is best lens in 70–300 For Nikon?	q
1139	21572	1	0	8	8	1	Which organic aloevera gel is best suited and effective for oily and acne prone skin type?	q
1140	21573	1	0	8	8	1	Which phone is best to buy under 15k?	q
1141	21574	1	1	0	1	1	Which place is best to work Mumbai or delhi?	q
1142	21575	1	0	8	8	1	Which platform is best for trade in Forex trading?	q
1143	21576	1	0	8	8	1	Which smart phone is best in 2016?	q
1144	21577	0	0	8	8	1	Who are best questioners on Quora?	q
1145	21578	1	0	0	1	1	Which real life people best match the characters in Game of Thrones?	q
1146	21579	0	1	8	8	1	What car is better Audi rs7 or bmw m6 gran coupe?	q
1147	21580	1	0	8	8	1	Would Real Madrid be better off without Cristiano Ronaldo?	q
1148	21581	0	1	0	1	1	Are dogs better than humans?	q
1149	21582	0	1	8	8	1	Are human beings better than animals?	q
1150	21583	1	1	0	1	1	Can cows be better pets than dogs and cats?	q
1151	21584	0	1	0	1	1	Do you agree that a liberal society is better as it allows liberal and conservative lifestyle but conservatism only allows conservative lifestyle?	q
1152	21585	0	1	8	8	1	For a US non-resident alien who resides in a country with territorial tax, who intends to have US Effectively Connected Income (ECI), is it better to set up a US LLC, a US C-Corporation, or a foreign entity?	q
1153	21586	0	1	0	1	1	From an objective point of view, assuming maximum life utility is the goal, is it better to be born male or female in the developed world?	q
1154	21587	0	1	0	1	1	How is a communist country better than a democratic country?	q
1155	21588	0	1	0	1	1	I got two offers Wipro and Accenture .pls suggest me which is better and why, while package of Accenture is 3.5 and Wipro is 3.25?	q
1156	21589	1	1	0	1	1	If I have one week, which country should I visit, Guatemala or Nicaragua? What should I not miss in any of them? Which one offers better scuba diving?	q
1157	21590	0	1	0	1	1	Is Babbel better than Rosetta Stone?	q
1158	21591	0	1	0	1	1	Is it better to be a famous rich person or an anonymous rich person?	q
1159	21592	0	1	0	1	1	Is it better to get a car loan through a dealership or a bank?	q
1160	21593	0	1	0	1	1	Is it better to take creatine before or after a workout and why?	q
1161	21594	1	1	0	1	1	Is Mac or Windows better for gaming?	q
1162	21595	0	1	0	1	1	Is ObamaCare really any better than Medicare?	q
1163	21596	0	1	0	1	1	Is reading the Game of Thrones books better than watching the TV series?	q
1164	21597	0	1	0	1	1	Is the PS4 or the Xbox One better?	q
1165	21598	0	1	0	1	1	Is Turkey better than Saudi Arabia?	q
1166	21599	1	1	0	1	1	Is UPS or USPS better for shipping mid-to-large size packages?	q
1167	21600	0	1	8	8	1	Love marriages or Arrange marriage? Which is better	q
1168	21601	0	1	0	1	1	What brand is better - Tampax or Playtex?	q
1169	21602	1	1	8	8	1	What is better for car loan; finance company or banks?	q
1170	21603	0	1	0	1	1	What is better Uber or Ola? Why?	q
1171	21604	1	1	8	8	1	What is the demand of biomedical engineers? Which stream is better Biomedical or Biotechnology?	q
1172	21605	1	0	8	8	1	What shoes look better with khaki pants and a shirt?	q
1173	21606	0	1	0	1	1	When is the random forest better than decision tree?	q
1174	21607	0	1	8	8	1	Which are better pro monitors Presonus Eris 4.5 or KRK Rokit 6 G3?	q
1175	21608	0	1	8	8	1	Which are better, Samsung or LG refrigerators?	q
1176	21609	0	1	8	8	1	Which bike is better, a Royal Enfield classic 350 or a Bullet 350?	q
1177	21610	0	1	8	8	1	Which coaching is better SKD or aakash in lucknow?	q
1178	21611	0	1	0	1	1	Which college is better DAVIET JALANDHAR or UIET KURUKSHETRA?	q
1179	21612	1	1	8	8	1	Which college is better for CSE: DTU/NSIT/IIITD?	q
1180	21613	0	1	8	8	1	Which CPU is better I3 4th Gen or 6th Gen?	q
1181	21614	0	1	8	8	1	Which exercise is better: with heavy weights and less reps, or with lighter weight and more reps? How will these two affect muscle growth?	q
1182	21615	1	0	8	8	1	Which hybrid bicycle is better in 20 to 25k?	q
1183	21616	0	1	8	8	1	Which is better China or Taiwan?	q
1184	21617	0	1	8	8	1	Which is better for a CS: IIT Guwahati or IIT Roorkee?	q
1185	21618	0	1	8	8	1	Which is better for CSE in VIT Vellore or certain with maths in IIIT Delhi?	q
1186	21619	1	1	0	1	1	Which is better for Java development: Eclipse or IntelliJ IDEA?	q
1187	21620	0	1	8	8	1	Which is better gun m16 or insas?	q
1188	21621	1	1	8	8	1	Which is better in mobile development - iOS or Android?	q
1189	21622	0	1	8	8	1	Which is better intel i5 (6th gen) or i7 (5th gen)?	q
1190	21623	1	1	8	8	1	Which is better law from BHU or Osmania university?	q
1191	21624	0	1	8	8	1	Which is better NIT Hamirpur ECE or VIT Vellore ECE?	q
1192	21625	0	1	0	1	1	Which is better, a career in environmental buildings or typical structural engineer?	q
1193	21626	0	1	0	1	1	Which is better, an edge LED TV or a direct LED TV?	q
1194	21627	0	1	8	8	1	Which is better, Bollywood or Kollywood?	q
1195	21628	0	1	8	8	1	Which is better, Redmi Note or Redmi Note 4G? Why?	q
1196	21629	0	1	0	1	1	Which is better, Snapdragon 625 or Snapdragon 650?	q
1197	21630	0	1	8	8	1	Which is better, the HMS Queen Elizabeth or the new Ford class Aircraft Carrier?	q
1198	21631	0	1	8	8	1	Which is better: Evernote or Google Keep?	q
1199	21632	0	1	0	1	1	Which is better: HP Pavilion 15-AU111TX or AU006TX?	q
1200	21633	0	1	8	8	1	Which is overall better, Amazon Echo or Google Home?	q
1201	21634	1	0	8	8	1	Which laptop is better for a enginnering student under Rs.25000?	q
1202	21635	1	0	8	8	1	Which MBA stream is better to pursue a mechanical engineer as fresher?	q
1203	21636	1	0	8	8	1	Which mobile is better under 15k?	q
1204	21637	0	1	8	8	1	Which one is better among KMC Manipal and KMC Mangalore?	q
1205	21638	1	1	0	1	1	Which one is better for a better career growth, Oracle DBA or SQL DBA?	q
1206	21639	0	1	0	1	1	Which one is better, an IIT or an IISc?	q
1207	21640	0	1	8	8	1	Which one is better, computer science or computer engineering? Why?	q
1208	21641	0	1	8	8	1	Which one is better: Intel Core i7 6500U Quad core with Intel HD Graphics 520 or Intel Core i7 6500U Dual core with Nvidia GeForce 940 2GB graphics?	q
1209	21642	0	1	8	8	1	Which one is better: Samsung Galaxy s7 edge or iPhone 6s?	q
1210	21643	0	1	0	1	1	Which OS is better, Windows 7 or Windows 10?	q
1211	21644	0	1	8	8	1	Which phone is better, a single SIM or a dual SIM?	q
1212	21645	0	1	8	8	1	Which show is better, The Office or Parks and Recreation?	q
1213	21646	0	1	8	8	1	Which software is better for a mechanical engineering student, Catia or Autocad?	q
1214	21647	0	1	8	8	1	Who is better between Hillary Clinton and Donald Trump as a US president?	q
1215	21648	1	0	8	8	1	Why do I study better at night?	q
1216	21649	0	1	0	1	1	Why is Chinese Democratic Meritocracy system better than the Western Style democracy?	q
1217	21650	0	1	8	8	1	Wordpress vs. Blogger which one is better?	q
1218	21651	0	1	8	8	1	How is Hillary Clinton better than Donald Trump?	q
1219	21652	0	1	8	8	1	How messi is better than Ronaldo?	q
1220	21653	0	1	8	8	1	In what aspects is Hillary Clinton better than Trump?	q
1221	21654	1	1	8	8	1	Is Quora better than Google for answers?	q
1222	21655	0	1	8	8	1	Is there any forum better than Quora?	q
1223	21656	0	1	8	8	1	Why is Hollywood better than Bollywood?	q
1224	21657	1	1	0	1	1	For a person who has no idea of Java or c++ coding, which technology is better to learn, Hadoop or SAP?	q
1225	21658	0	0	1	0	1	What are biggest secrets of Aghori Sadhus?	q
1226	21659	1	0	8	8	1	What is your biggest achievement in your job?	q
1227	21660	1	0	8	8	1	What is your biggest regret of your life?	q
1228	21661	0	0	0	1	1	What is your biggest regret you can still do something about?	q
1229	21662	1	0	1	0	1	Which country in the world has biggest vegetarian population (not vegan)?	q
1230	21663	1	0	0	0	1	Why does a submarine implode at a certain depth, but some marine life can live on the ocean floor in the deepest oceans without being crushed?	q
1231	21664	0	1	0	1	1	What do I buy, an iPhone 7+, Samsung Galaxy S7 Edge, or Google Pixel?	q
1232	21665	1	0	8	8	1	Which gaming laptop can I buy under 30000?	q
1233	21666	1	1	0	0	1	I am from India and am visiting Dubai during DSF. Where can I buy a good, genuine laptop and car audio accessories for the main unit with international warranty? Will there be a price difference compared to India?	q
1234	21667	1	0	0	0	1	Where can I get the best digital marketing course (online & offline) in India?	q
1235	21668	0	1	0	1	1	Do you feel that the life in your country has changed alot since 2000?	q
1236	21669	0	0	0	0	1	What is cheapest method to calculate shipping rates?	q
1237	21670	0	1	0	1	1	What should I choose, Thapar for CSE or BIT Mesra for IT and why?	q
1238	21671	0	1	8	8	1	Why is Sri lanka and Bangladesh, so much cleaner than India?	q
1239	21672	0	1	8	8	1	How good are the best neuroscience programs in India? Are they comparable with worldwide top universities?	q
1240	21673	0	1	0	1	1	Can you compare Donald Trump and Ronald Reagan?	q
1241	21674	0	1	8	8	1	How do the gut microbiomes of herbivore animals compare with those of carnivore animals?	q
1242	21675	0	1	8	8	1	How does Edgware compare with other neighbourhoods in London?	q
1243	21676	0	1	8	8	1	How does the immune response against antigens compare against nucleic acids?	q
1244	21677	1	1	8	8	1	What is the scope of ubiquitous computing? How can you compare UC with image processing in terms of future growth and market?	q
1245	21678	1	1	8	8	1	What type of government does Turkey have? How does it compare to the one in Colombia?	q
1246	21679	0	1	8	8	1	Why did the industrial revolution first occur in England? How does it compare with that in India at present?	q
1247	21680	1	1	0	0	1	How much urjit Patel Suits to RBI as a governor: compare with Raghuram Rajan sir?	q
1248	21681	1	1	0	0	1	What is the process to determine the density of aluminum and how does gold compare?	q
1249	21682	0	1	8	8	1	Where does the water from the Great Lakes come from, and how does these lakes wildlife compare to Lake Geneva?	q
1250	21683	1	1	8	8	1	How can the drive from Edmonton to Auckland be described, and how does the history of these cities compare and contrast to the history of Vancouver?	q
1251	21684	0	1	8	8	1	How can you compare and contrast a rice cooker and a slow cooker?	q
1252	21685	0	1	0	0	1	How do short and open circuits compare and contrast?	q
1253	21686	0	1	8	8	1	How does a a pluralistic society compare and contrast to a regular society?	q
1254	21687	0	1	8	8	1	What are some common examples of non-vascular plants, and how do they compare and contrast to vascular plants?	q
1255	21688	0	1	8	8	1	What was the significance of the battle of Somme, and how did this battle compare and contrast to the Battle of Nanshan?	q
1256	21689	0	1	0	0	1	What was the significance of the battle of Somme, and how did this battle compare and contrast to the Battle of Port Arthur?	q
1257	21690	0	1	0	0	1	What was the significance of the battle of Somme, and how did this battle compare and contrast to the Battle of Penang?	q
1258	21691	1	1	0	0	1	How can the drive from Edmonton to Auckland be described, and how do these cities' attractions compare to those in Toronto?	q
1259	21692	1	1	0	0	1	How cold can the Gobi Desert get, and how do its average temperatures compare to the ones in the Atacama Desert?	q
1260	21693	1	1	1	0	1	How cold can the Gobi Desert get, and how do its average temperatures compare to the ones in the Great Victoria Desert?	q
1261	21694	1	1	1	0	1	How cold can the Gobi Desert get, and how do its average temperatures compare to the ones in the Karakum Desert?	q
1262	21695	1	1	1	0	1	How cold can the Gobi Desert get, and how do its average temperatures compare to the ones in the Syrian Desert?	q
1263	21696	0	1	8	8	1	How do Bangalore bus routes compare to Ranchi's, and what authority oversees them?	q
1264	21697	0	1	8	8	1	How do nude beaches in Punta Cana compare to other nude beaches in Barbados?	q
1265	21698	0	1	8	8	1	How do Oxford and Cambridge compare to Harvard and Stanford?	q
1266	21699	0	1	0	0	1	How do the tourist attractions on the Scandinavian Highlands compare to attractions in Luxembourg?	q
1267	21700	0	1	8	8	1	How does ISB, Hyderabad compare to IIM Ahmedabad?	q
1268	21701	0	1	0	0	1	How does laryngitis compare to bronchitis?	q
1269	21702	0	1	8	8	1	How does Sauron's power compare to that of Morgoth?	q
1270	21703	0	1	0	1	1	How does Shobhit University in Meerut's academic program compare to the University of Calcutta's?	q
1271	21704	0	1	8	8	1	How does the new Airbus A350XWB compare to the Boeing 787 Dreamliner?	q
1272	21705	0	1	8	8	1	How does Tim Hortons coffee compare to Starbucks coffee?	q
1273	21706	0	1	8	8	1	What are the benefits of green jasmine tea? How do they compare to those of chamomile tea?	q
1274	21707	0	1	0	0	1	What are the main imports and exports of Venezuela, and how does Venezuela's industry compare to Uruguay's?	q
1275	21708	0	1	8	8	1	What are the rules and regulations when visiting an inmate at Valdosta prison and how does it compare to prisons in Hawaii?	q
1276	21709	0	1	0	0	1	What is Ontario's motto and its significance, how does it compare to Arizona's?	q
1277	21710	1	1	8	8	1	What is the crime rate in the Borough of Ealing and how does it compare to Bexley?	q
1278	21711	0	1	8	8	1	What is the location of Palawan, and how does this Island compare to Aitutaki?	q
1279	21712	0	1	1	0	1	What is the longest roller coaster in the United Kingdom and how does it compare to the longest roller coaster in Singapore?	q
1280	21713	1	1	8	8	1	What is the Sahara, and how do the average temperatures there compare to the ones in the Colorado Plateau?	q
1281	21714	1	1	8	8	1	What is the Sahara, and how do the average temperatures there compare to the ones in the Dasht-e Margo?	q
1282	21715	1	1	8	8	1	What is the Sahara, and how do the average temperatures there compare to the ones in the Great Victoria Desert?	q
1283	21716	1	1	8	8	1	What is the Sahara, and how do the average temperatures there compare to the ones in the Mojave Desert?	q
1284	21717	1	1	8	8	1	What is the Sahara, and how do the average temperatures there compare to the ones in the Registan Desert?	q
1285	21718	1	1	8	8	1	What is the Sahara, and how do the average temperatures there compare to the ones in the Simpson Desert?	q
1286	21720	0	1	8	8	1	What type of government does Turkey have? How does it compare to the one in Jordan?	q
1287	21721	0	1	8	8	1	What were the major effects of the cambodia earthquake, and how do these effects compare to the Iquique earthquake in 1877?	q
1288	21722	0	1	8	8	1	What were the major effects of the cambodia earthquake, and how do these effects compare to the Peru earthquake in 1687?	q
1289	21723	0	1	1	0	1	What were the major effects of the cambodia earthquake, and how do these effects compare to the Sanriku earthquake in 1896?	q
1290	21724	0	1	8	8	1	What were the major effects of the cambodia earthquake, and how do these effects compare to the Somatra earthquakes in 2007?	q
1291	21725	0	1	8	8	1	What were the major effects of the cambodia earthquake, and how do these effects compare to the Tohoku earthquake in 2011?	q
1292	21726	0	1	1	0	1	What were the major effects of the cambodia earthquake, and how do these effects compare to the Valparaiso earthquake in 1822?	q
1293	21727	8	1	8	8	1	Where is Mount Villarica located and how does its eruptive history compare to Mount Popocatépetl?	q
1294	21728	0	1	8	8	1	Where is the Baraka River located, and how does it compare to the Parana River?	q
1295	21729	0	1	8	8	1	Where is the Baraka River located, and how does it compare to the Volga River?	q
1296	21730	0	1	8	8	1	Where is the Hole-in-the-Wall located in South Africa, and how does this natural formation compare to others in Afghanistan?	q
1297	21731	1	1	8	8	1	Why India is not able to perform well in Rio Olympic 2016 as compare to London and Beijing Olympics?	q
1298	21732	0	1	1	0	1	What is Secretary Clinton's IQ and how does it compare with that of Trump?	q
1299	21733	1	1	8	8	1	How much do Hooters waitresses make compared to regular waiters and waitresses?	q
1300	21734	0	1	8	8	1	What is it like flying from Bangkok to Manila and how are these touristic cities compared to Chennai?	q
1301	21735	0	1	8	8	1	What is it like flying from Bangkok to Manila and how are these touristic cities compared to Xi'an?	q
1302	21736	1	1	8	8	1	Why are human beings so intelligent compared to all the other kinds of animals?	q
1303	21737	0	1	0	0	1	I am 14, and compared to some of my peers at school, my life seems very uninteresting, what can I start doing now to stop this?	q
1304	21738	0	1	0	0	1	What is the property tax rate in Granville, Ohio? How is it compared to the one of Alaska?	q
1305	21739	1	1	8	8	1	When and why did black pepper become so popular when it is so flavorless compared to white pepper? And what is the difference?	q
1306	21740	0	1	8	8	1	Are book reviews on goodreads worth reading (compared to book reviews on Amazon)?	q
1307	21741	1	1	1	0	1	Do rats carry more diseases when they are dead compared to being alive?	q
1308	21742	1	1	8	8	1	How can I use Omegle on my iPod Touch and how is it compared to using iMeetzu?	q
1309	21743	0	1	8	8	1	How hard is it to learn Russian (compared to Japanese)?	q
1310	21744	1	1	8	8	1	How is blade commerce controlled in Vermont compared to Arizona under the knife legislation?	q
1311	21745	0	1	8	8	1	How is junior college in Singapore compared to Pakistan?	q
1312	21746	1	1	0	1	1	How smart was Steve Jobs compared to Mark Zuckerberg?	q
1313	21747	0	1	0	1	1	What is city life in India like compared to Nepal?	q
1314	21748	1	1	0	1	1	What is GATE? How difficult is it compared to JEE?	q
1315	21749	0	1	0	1	1	What is it like flying from Bangkok to Manila and how are these touristic cities compared to Tokyo?	q
1316	21750	0	1	8	8	1	What kind of economy does the United States have compared to the one in Spain?	q
1317	21751	0	1	8	8	1	What was the production of artwork intended for in Hawaii and how is it compared to the one intended for in Maine?	q
1318	21752	0	1	1	0	1	Which are the major highways in California and how are they compared to the major highways in Iowa?	q
1319	21753	0	1	8	8	1	Which are the major highways in California and how are they compared to the major highways in Maine?	q
1320	21754	0	1	8	8	1	Which car services are available in Orlando? How good are they compared to taxis and relative to each other?	q
1321	21755	0	1	8	8	1	Why did only human beings evolve so much compared to other animals?	q
